name,title,link,content,img,date
한국경제,증시 좀비기업 반드시 퇴출할 것…암호화폐 ETF 상장해야 | 한국경제,https://www.hankyung.com/article/2025020934271,"한국 증시가 위기라고 한다. 등을 돌린 개인투자자가 돌아오지 않고 있어서다. 코스피지수는 작년 하반기에만 15% 가까이 빠졌다. 미공개 정보를 이용한 불공정 거래 논란, 계속되는 분할상장, 잊을 만하면 나오는 유상증자, 넘쳐나는 ‘좀비기업’에 지쳤다는 하소연도 외면하기 어렵다.시장의 관리자이자 감시자인 한국거래소 역할이 막중한 이유다. 정통 경제관료 출신으로 오는 15일 취임 1년을 맞는 정은보 한국거래소 이사장을 만나 증시 운영 계획을 들었다. 그는 “과거에 기업들은 우리 증시에 상장돼 있다는 걸 명예롭게 생각했다”며 “시장 관리와 감독을 대폭 강화해 명예를 되찾아주는 게 내 임무”라고 강조했다.“분명한 건 미래 현금 흐름의 현재 가치가 주가란 점입니다. 기업이 얼마나 벌어들일지에 대한 예상이 중요하다는 거죠. 사람들은 10~20년 후 삼성전자 수익성이 유지될지, 우리 배터리 기업이 중국과 경쟁할 수 있을지 자신하지 못하고 있습니다. 산업 경쟁력 약화가 근본 배경인 점을 부인하기 어렵습니다. 그동안 우리가 인정받은 게 ‘가장 빠른 추격자’(fastest follower) 전략이었는데 요즘엔 그렇지 않죠. 인공지능(AI) 같은 분야에서 성과가 제대로 안 나오는 걸 보세요. 이대로면 일본처럼 30년 이상 침체를 겪지 않으리란 법이 없습니다.”“지난 10년 정도만 놓고 보면 그렇지만 길게 보면 다릅니다. 1990년 초 3만8000을 넘은 닛케이지수는 2000년대 8000까지 떨어졌다가 작년에야 전고점을 회복했습니다. 35년간 제자리걸음을 한 셈이죠. 미국 다우존스지수는 같은 기간 2700에서 4만5000으로 15배 넘게 뛰었습니다. 산업 경쟁력의 차이가 그만큼 큽니다. 우리도 기업가정신으로 재무장하지 않으면 일본 전철을 밟을 수 있어요. 코스피지수 전고점이 3300(2021년 6월)이었는데, 30년 후에나 이 숫자를 다시 볼 수 있다고 생각해 보세요. 두려운 현실이죠.”“사실입니다. 우리 기업들의 본질 가치가 유독 낮은 가격으로 거래되고 있는 게 문제에요. 해외 비슷한 기업끼리 비교하면 70~80% 수준에 불과합니다. 주주친화 경영이 미흡한 수준이라는 데 큰 원인이 있다고 봅니다. 주주 간 이해 충돌이 생길 때 소액주주 입장이 제대로 반영되면 좋겠어요. 경영 정보 역시 좀 더 투명해야겠죠. 거래소가 작년부터 중점 추진해온 밸류업 정책은 기업가치를 제대로 평가받도록 하는 게 목적입니다. 주주환원 확대를 통해서죠.”“성공적으로 진행되고 있습니다. 작년 자사주 매입과 소각이 꽤 늘었고 배당도 증가했지요. 밸류업 공시에 동참한 상장회사가 지금까지 108곳에 달합니다. 순수 내수 기업인 금융주 주가가 작년에 많이 뛴 걸 보세요. 금융산업의 본질적 가치가 올라 주가가 상승한 건 아닐 겁니다. 금융회사처럼 주주환원을 열심히 하면 기업 주가가 제 평가를 받을 수 있습니다.”“작년 취임하면서 ‘상장기업 수 축소’를 화두로 던졌습니다. 미국 국내총생산(GDP)은 우리의 15배인데 상장회사 수는 두 배에요. 한국 상장기업이 미국보다 일곱 배 많다는 뜻이죠. 한국에선 상장에 대한 환상과 오해가 많은 것 같습니다. 제2의 기업 성장을 위한 통로가 상장인데, 많은 사람이 (구주 매출을 통한) 자금 회수(엑시트) 방법으로 여기고 있어요. 이런 기업들 물량을 개인이 받아주면서 피해가 생길 수 있지요. 최소한 중복 상장과 관련해선 소액주주 보호 장치를 강화하는 방법을 찾고 있습니다. 기업 사이에서 물적분할은 더 이상 추진하지 않겠다는 분위기가 생긴 점도 다행이죠. 시장 신뢰를 좀먹는 한계기업은 빨리 털어내야 합니다. 지난달 퇴출 속도를 높이는 조치를 발표했는데, 앞으로 더 센 규정들을 마련할 겁니다.”“코스닥시장 출범 초기만 해도 여기 상장된 기업들은 명예롭다는 생각을 많이 했습니다. 지금은 달라졌죠. 문제가 많은데도 상장 상태만 유지하는 좀비기업 때문입니다. 일부 엉터리 기업 때문에 코스닥시장 전체 신뢰도가 땅에 떨어지고 있는 겁니다. 미공개 정보를 이용하는 불공정 거래도 짚어봐야 합니다. 공시가 나오기도 전에 주가가 급등락하는 사례가 적지 않은데, 불공정 거래는 원래 형사처벌 대상입니다. 기업에 책임이 있다면 증시 퇴출도 할 수 있게 해야죠.”“오해가 많은 것 같습니다. 원래 무차입 공매도는 한국을 포함해 대부분 나라에서 불법입니다. 공매도 주문을 낼 때는 차입이 돼 있어야 하죠. 검증이 제대로 이뤄지지 않다 보니 무차입 공매도가 생기곤 했습니다. 공매도 전면 금지 기간에 공매도 중앙점검 시스템을 개발했습니다. 막바지 테스트를 하고 있는데 3월 말 공매도가 재개되면 기존 우려는 다 불식될 겁니다. 해외 거래소도 우리 시스템을 도입하겠다고 할 정도예요. 일부 개인 사이에서 공매도 자체를 반대하기도 하는데 이건 꼭 필요한 제도입니다. 특정 종목 주가가 과열됐다고 판단하면 차입해서라도 팔도록 해야 ‘가격 발견’ 기능을 정상화할 수 있어요. 모건스탠리캐피털인터내셔널(MSCI) 선진국지수 편입 문제를 떠나서요.”“퇴직연금 적립금을 운용할 때 주식 등 위험자산 한도를 70%로 묶어두는 건 무리한 규제입니다. 국가가 과도한 후견인 역할을 수행하겠다는 건 시대 흐름에 맞지 않습니다. 투자자 스스로 노후를 설계할 수 있도록 관련 규제를 확 풀어야 합니다. 미국엔 이런 운용 규제가 아예 없어요.”“한국은 세계 3위 암호화폐 실물 거래국입니다. 암호화폐야말로 금융산업에서 새로운 가치를 창출할 수 있는 분야죠. 미국은 선·현물 ETF가 상장돼 활발하게 거래되고 있습니다. 더 늦지 않게 암호화폐 ETF 거래를 풀어줘야 합니다.”여야 간 첨예하게 대립하고 있는 상법 개정에 대해서도 정은보 한국거래소 이사장은 분명한 반대 목소리를 냈다. 정 이사장은 “주주 보호 장치를 강화하고 ‘코리아 디스카운트’를 해소하려는 취지에는 공감한다”면서도 “상법보다 적용 대상이 명확한 자본시장법 개정이 맞는 방향”이라고 강조했다.그는 상법 개정안에 대해 “대한민국 법인이 100만 개에 달하는데 이 중 상장사는 2600여 곳뿐”이라며 “나머지 99만 개 이상 기업엔 소액주주가 아예 존재하지 않는다”고 했다. 대부분 회사에서 대주주와 소액주주 간 이해 상충 문제가 발생하지 않는데, 전체 기업을 대상으로 삼는 상법에 관련 조항(이사의 충실의무 대상을 주주까지 확대)을 추가하는 건 과도한 입법이란 얘기다.정 이사장은 “기껏해야 가족 간 분쟁이 전부인 대다수 법인을 대상으로 이사 의무를 확대하면 대표적인 과잉 입법 사례가 될 것”이라고 비판했다.재계 또한 상법 개정안에 강하게 반대하고 있다. 상법 개정안이 통과되면 소액주주 소송 남발과 이사회 위축에 따른 경영 왜곡이 심해질 것이란 우려에서다.정 이사장은 “과거 세계적인 파생상품 시장을 갖췄었는데 (규제 등 때문에) 지금은 크게 위축됐다”면서 “요즘 기관들이 전부 현·선물 투자를 연계한다는 점을 감안할 때 파생 시장을 적극 육성해야 한다”고 강조했다.정리=박한신/심성미 기자 phs@hankyung.com",https://img.hankyung.com/photo/202502/AA.39436011.1.jpg,2025-02-09
한국경제,"저평가된 국장, 저점 분할매수할 타이밍 | 한국경제",https://www.hankyung.com/article/2025020933771,"지금의 증시 상황을 표현하면 이렇다. 미국 주식 시장은 경제성장률도 높고 물가도 안정적이며 기업실적 등도 좋지만 비싸다. 반면 한국은 경제성장률, 원·달러 환율 등 불확실성이 존재하지만 매우 싸다.주식시장이 고평가돼 있는지 저평가돼 있는지 볼 때 많이 보는 지표 중 하나가 주가순자산비율(PBR)이다. PBR은 가격이 기업의 장부가치에 비해 얼마나 높은지를 나타내는 지표다. PBR이 1배보다 높으면 시장에서 기업이 장부가치보다 높은 가치를 인정받고 있다는 의미다. 1배보다 낮으면 주가가 기업의 장부가치보다 낮다는 뜻으로, 저평가 가능성이 있다.한국거래소에 따르면 현재 코스피지수의 PBR은 0.87배 수준으로 매우 낮은 편이다. 국민은행은 이달 하우스 뷰에서 국내 증시의 밸류에이션(가치 평가)이 매력적인 구간에 진입했다고 평가했다. 외국인 매도를 불러왔던 실적 불확실성이 해소되며 수급 여건 개선을 기대할 수 있을 것으로 예상했다. 앞으로 환율이 지금보다 하락한다면 외국인에게 한국을 더 싸보이게 만드는 효과도 있다고 했다.과거 경험을 보면 원·달러 환율이 높을 때(원화 약세 구간) 코스피지수는 낮았으며, 환율이 안정되면서 코스피지수가 상승했다. 국내 주식이 연속으로 안 좋았던 때도 별로 없었다. 작년에 국내 증시는 세계 증시 중 바닥권이었기 때문에 확률적으로 올해는 작년보다 좋을 수 있다.물론 불확실성이 확대될 가능성은 존재한다. 이를 감안해 좀 더 보수적인 투자 방법으로 저평가된 현재 지수에서 일부 매수하고, 하락 시 추가 매수한다는 설정을 하면서 여유 자금을 남겨 두고 투자하기를 권한다. 지난해까지는 미국 주식 투자자가 투자에 성공했을 것이다. 하지만 올해는 국내 증시에도 투자 타이밍을 분산하면서 포트폴리오 비중을 가져가는 것도 방법이다. 귀찮고 어렵더라도 자산을 분산하고 투자 시점을 나누는 포트폴리오 관리가 투자의 기본 중의 기본이기 때문이다",https://img.hankyung.com/photo/202502/AA.39455816.1.jpg,2025-02-09
머니투데이,"""ETF 광고 수익률에 속지 마세요"" 금감원, 시정조치 - 머니투데이",http://news.mt.co.kr/mtview.php?no=2025020716592569810,"금융감독원이 ETF(상장지수펀드) 상품 광고에 표기된 수익률이 예상·목표치 등 실현되지 않은 수익률을 강조하는 경우가 있다며 문제가 있는 광고물은 수정·삭제 등 시정조치했다. 더불어 소비자 유의사항도 안내했다.금감원은 자산운용사 10곳의 ETF 광고 252건을 점검한 결과 일부 광고에서 수익률이 좋았던 기간의 수익률을 표시하거나 예상·목표치 등 실현되지 않은 수익률을 강조한 경우가 적발됐다고 9일 밝혔다.ETF 상품은 원금손실이 가능한데도 일부 광고는 ETF 상품을 안전한 상품으로 표현하거나, 장기 성과에 영향을 미치는 수수료에 관한 사항을 기재한 경우도 있었다.금감원은 금융투자협회와 점검을 벌여 부적절한 광고물에 대해서는 수정·삭제 등 조치했다. 유사한 사례가 반복되지 않도록 지난해 12월 자산운용사 간담회에서 광고 관련 내부통제 강화를 지도했다.ETF는 주로 시장지수와 동일한 성과가 목표인 인덱스펀드를 거래소에 상장시켜 주식처럼 편리하게 거래되도록 만든 상품이다. 원금손실이 가능한 투자성 상품이다. 투자대상에 따라 주식형, 채권형, 주식·채권 혼합형, 원자재형 등으로 분류된다.금감원은 ""ETF 상품 투자시에는 특정 기간의 성과만으로 투자 여부를 판단할 것이 아니라 장기 성과와 변동성을 함께 고려해야 한다""며 ""제시된 수익률의 의미를 살펴보고 최소 1년 이상의 수익률과 상품의 위험성을 함께 고려해 투자를 결정해야 한다""고 당부했다.더불어 ETF 상품은 손실가능성이 있다는 점을 유의해야 한다고 강조했다. 특히 정기적으로 분배금을 지급하는 ETF 광고의 경우 안정적인 수익을 제공하거나 손실 위험이 거의 없는 상품으로 오인하게 만드는 사례가 나타나고 있다. 그러나 분배금은 ETF의 기초자산인 주식·채권의 배당·이자 등을 재원으로 지급된다. 지급된 분배금만큼 ETF 순자산은 감소하고 기초자산 하락시에는 투자손실이 발생할 수 있다.'최초', '최저'와 같은 과장 문구도 주의해야 한다. 기준일이나 비교범위에 따라 진위여부가 달라질 수 있으므로 진위를 반드시 확인해야 한다.수익률뿐 아니라 수수료 역시 반드시 확인해야 한다. 코스피 등 동일 지수를 추종하는 ETF 상품들의 기초자산에 따른 성과는 서로 유사하므로, 장기적인 성과는 실제 부담하는 수수료에 따라 달라질 수 있다. 수수료는 광고에 필수 기재해야 하는 사항으로, 투자 여부를 판단할 때 각종 수수료를 참고해야 한다. 투자 전 상품설명서와 약관 등을 확인해 상품의 구조, 기초자산, 운용보수·기타 비용 등 필수 정보도 확인해야 한다.금감원은 허위·과장 광고물로 소비자 피해가 우려될 경우 소비자경보를 발령하는 등 유의사항을 지속적으로 안내할 계획이다.",https://thumb.mt.co.kr/06/2025/02/2025020716592569810_1.jpg/dims/optimize/,2025-02-09
머니투데이,"美·中 관세 갈등에 증시 눈치보기 계속…""새로운 주도주 찾아야"" - 머니투데이",http://news.mt.co.kr/mtview.php?no=2025020911063933726,"이번 주(2월10일~14일) 국내 증시는 미국과 중국의 관세 갈등에 영향을 받을 것으로 보인다. 투자자들은 미·중 갈등 결론이 날 때까지 관망세를 보이면서 새로운 주도주 찾기에 나설 것이란 전망이 나온다.9일 한국거래소에 따르면 지난주(2월3일~7일) 코스피는 전주(2517.37) 대비 4.55포인트(0.18%) 오른 2521.92에 거래를 마쳤다. 이 기간 개인은 코스피 시장에서 주식을 3602억원 순매수했다. 반면 외국인과 기관은 각각 6122억원과 2649억원 순매도했다.지난주 국내 증시는 도널드 트럼프 미국 대통령이 던진 관세폭탄을 따라 등락했다. 트럼프 대통령은 지난 2일(현지시각) 캐나다와 멕시코에 25% 보편관세, 중국에 10% 추가 관세를 부과하겠다고 확정한 행정명령에 서명했다. 이에 지난 3일 코스피는 전 거래일 대비 2.52% 하락, 2453.95로 밀려났다. 다만 트럼프 대통령이 관세 부과를 유예하겠다고 밝히면서 코스피는 지난 5일 2500선을 회복했다.중국과의 갈등은 현재 진행 중이다. 트럼프 대통령은 아직 시진핑 중국 국가주석과 통화를 하지 않았다. 오는 10일(현지시각)부터 중국은 일부 미국산 수입품에 10~15% 추가 관세를 부과하는 등 보복관세를 시행할 예정이다. 그러나 아직 미국은 이렇다 할 움직임을 보이지 않고 있다.나정환 NH투자증권 연구원은 ""시진핑 주석과 트럼프 대통령 간 통화가 이뤄지지 않은 만큼 실제 통화 이후 결과에 따라 주식시장 방향성이 결정될 것""이라고 했다. 이어 ""이번 주 코스피는 2450~2580선에서 움직일 것""이라고 덧붙였다.미·중 갈등에 대한 경계감이 가득한 상황에서도 증시 투자자들은 새로운 주도주 찾기에 나설 것으로 보인다. 특히 딥시크 충격 등으로 투자 트렌드가 기존 AI(인공지능) 하드웨어에서 소프트웨어로 넘어간 만큼, 이와 관련된 기업들이 관심을 받을 것으로 예상된다.이은택 KB증권 연구원은 ""딥시크 충격 이후 증시 되돌림을 주도한 것은 소프트웨어, 전력·원전, 중국 기술주 등의 소프트AI주(株)였다""며 ""단기 급락이 반복되겠으나 업종에서는 AI 소프트웨어가 주도주로 활약할 것""이라고 말했다.실제로 지난주 증시에서 네이버()는 4.16% 상승했다. 오픈AI와 전략적 제휴를 맺은는 16.04% 뛰었다. 카카오와 오픈AI는 앞으로 AI 서비스 고도화를 위한 기술 협력, 공동 상품 개발을 추진할 계획이다.나 연구원은 ""연초 이후 외국인 자금이등 AI 하드웨어 중심으로 유입되나 싶더니 딥시크 이슈와 샘 올트먼 오픈AI CEO(최고경영자) 협업 소식에 AI 소프트웨어 관련주가 강세를 보였다""며 ""그동안 소외됐던 소프트웨어 업종으로 수급이 움직이면서 주가에 긍정적으로 작용할 수 있다""고 분석했다.전문가들은 AI 소프트웨어 업체 외에도 방산, 조선, 바이오, 엔터 등의 업종에도 주목해야 한다고 조언했다. 미국의 정책 불확실성이 큰 상황에서 이를 피해 갈 수 있는 업종들이기 때문이다.신승진 삼성증권 투자정보팀장은 ""트럼프 행정부의 최종 목표는 관세가 아니라, 이를 도구로 보다 큰 미국의 이익을 확보하는 것""이라며 ""이 과정에서 정책 불확실성으로 금융 시장의 변동성이 일어날 수 있는 만큼 철저히 트럼프 행정부 정책에 수혜가 되거나, 통상 불확실성과 무관한 기업에 투자하는 것이 좋은 선택지""라고 설명했다.신 팀장은 ""방산, 조선, 바이오, 엔터 등은 해외 매출 비중이 높고, 미국 통상 우려와 무관한 기업""이라며 ""이번 주에는 SK하이닉스,,,,,,,,,등을 주목해야 한다""고 했다.",https://thumb.mt.co.kr/06/2025/02/2025020911063933726_1.jpg/dims/optimize/,2025-02-09
이데일리,"코스피, 장중 상승 전환…기관 사자",http://www.edaily.co.kr/news/newspath.asp?newsid=02935606642069208,"[이데일리 이정현 기자] 트럼프 관세 쇼크에 하락 출발한 코스피 지수가 장중 상승 전환했다.10일 엠피닥터에 따르면 오후 1시38분 현재 코스피 지수는 전 거래일 대비 0.07%(1.70포인트) 오른 2523.62에 거래중이다. 장초반 2499.18까지 하락하며 2500선이 무너졌으나 오후들어 반등했다.수급별로 기관 수급이 반등을 주도하고 있다. 978억원어치 순매수 중이다. 반면 외국인은 1269억원, 개인은 210억원어치 순매도 중이다.지난주 뉴욕 증시는 미국 소비자들의 기대 인플레이션이 이례적으로 급등한 데다 관세 쇼크에 따른 무역 분쟁 본격화 가능성에 하락마감했다. 뉴욕증권거래소(NYSE)에서 다우존스30산업평균지수는 전장보다 444.23포인트(0.99%) 밀린 4만4303.40에 거래를 마감했다. 스탠더드앤드푸어스(S&P)500지수는 전장보다 57.58포인트(0.95%) 떨어진 6025.99, 나스닥종합지수는 268.59포인트(1.36%) 급락한 1만9523.40에 장을 마쳤다.한지영 키움증권 연구원은 보고서에서 “이번주 한국 증시는 트럼프의 상호관세 발표, 미국의 1월 CPI, 소매판매 등 주요 경제지표, 파월 의장의 상하원 청문회 발언, 카카오, 한화에어로스페이스 등 국내 주요 기업 실적, MSCI 분기 리뷰 및 옵션 만기일에 따른 수급 변동성 등에 영향 받을 것”이라 전망했다. 지수 방향성은 정체된 채 업종별 순환매 장세의 성격이 짙을 것이란 진단이다.업종별 상승 우위다. 오락문화와 섬유의류가 1%대 오르는 가운데 금속은 1%대 하락하고 있다. 나머지 업종은 보합권에서 등락 중이다.시가총액 상위주는 혼조 흐름이다. 삼성전자(005930)가 강보합인 가운데 SK하이닉스(000660)는 1%대 약세다. 삼성바이오로직스(207940)는 약보합, LG에너지솔루션(373220)은 1%대 강세다. 현대차(005380)와 셀트리온(068270)은 보합권이다.종목별로 엑시큐어하이트가 가격제한폭까지 오른 상한가다. 디아이씨(092200)가 16%대, 이수스페셜티케미컬(457190)이 15%대 오르고 있다. 반면 OCI(456040)는 8%대, 세방전지(004490)와 유니켐(011330), 한미반도체(042700)는 6%대 주가가 빠지는 중이다.",https://image.edaily.co.kr/images/photo/files/NP/S/2025/02/PS25021000808.jpg,2025-02-10
이데일리,[코스피 마감]트럼프 관세 쇼크 소화…삼성전자 3% 반등,http://www.edaily.co.kr/news/newspath.asp?newsid=03276726642069208,"[이데일리 이정현 기자] 코스피 지수가 도널드 트럼프 대통령의 관세 쇼크로 출렁이다 약보합 마감했다. 삼성전자(005930)는 마감을 앞두고 급등하며 5만원대 중반을 회복했다.10일 엠피닥터에 따르면 이날 코스피 지수는 전 거래일 대비 0.03%(0.68포인트) 내린 2521.24에 장을 마감했다. 장초반 2500선이 무너지며 2499.18까지 하락했으나 이후 반등했다. 장중 2526.33까지 올랐다.기관 수급이 지수를 끌어올렸다. 이날에만 2669억원어치 순매수했다. 반면 개인은 741억원, 외국인은 2773억원어치 내다 팔았다.지난주 뉴욕 증시는 미국 소비자들의 기대 인플레이션이 이례적으로 급등한 데다 관세 쇼크에 따른 무역 분쟁 본격화 가능성에 하락마감했다. 뉴욕증권거래소(NYSE)에서 다우존스30산업평균지수는 전장보다 444.23포인트(0.99%) 밀린 4만4303.40에 거래를 마감했다. 스탠더드앤드푸어스(S&P)500지수는 전장보다 57.58포인트(0.95%) 떨어진 6025.99, 나스닥종합지수는 268.59포인트(1.36%) 급락한 1만9523.40에 장을 마쳤다.이경민 대신증권 연구원은 “장 초반 관세 우려에 하락하며 2500선 내주었으나, 이슈 소화하며 2520선 보합권을 회복했다”며 “트럼프 대통령의 이번 상호 관세조치는 EU산 자동차와 철강 등을 겨냥한 조치인 것으로 전망되며 코스피는 관세 이슈 소화하면서 오후장에서 하락폭을 되돌렸다”고 진단했다.업종별로 혼조 마감했다. 오락문화가 1.90%, 섬유의류가 1.05% 오른 반면 금속은 1.22% 하락했다. 나머지 업종은 보합권에 머물렀다.시가총액 상위주는 혼조 마감했다. 시총 1위 삼성전자는 이날 3.54% 오르며 5만5600원에 장을 마쳤다. 반면 SK하이닉스(000660)는 2.41% 하락했으며 LG에너지솔루션(373220)은 3.12% 상승했다. 삼성바이오로직으는 2.59% 하락, 현대차(005380)와 셀트리온(068270)은 약보합 마감했다.종목별로 엑시큐어하이트가 가격제한폭까지 오른 상한가 마감했다. 이수스페셜티케미컬(457190)이 24.29%, 디아이씨(092200)가 16.81%, 삼화전기(009470)가 13.73% 올랐다. 반면 OCI(456040)는 8.93% 하락했으며 금호건설우(002995), HD현대마린솔루션(443060), OCI홀딩스(010060), 한화오션(042660), 한미반도체(042700), SNT에너지(100840)는 6%대 하락마감했다.이날 거래량은 3억8682만주, 거래대금은 10조3823억원으로 집계됐다. 상한가 1종목 외 416개 종목이 올랐고 하한가 없이 458개 종목이 내렸다. 69개 종목은 보합 마감했다.",https://image.edaily.co.kr/images/photo/files/NP/S/2025/02/PS25021000945.jpg,2025-02-10
