name,title,link,content,img,date
이데일리,[ETF언박싱]‘배당 자동재투자’ 제동…TR 떼고 분배형 전환,http://www.edaily.co.kr/news/newspath.asp?newsid=01649846642066256,"[이데일리 원다연 기자] 세법 개정에 따라 오는 7월부터 토탈리턴(TR)형 상장지수펀드(ETF) 운용에 제동이 걸리면서 삼성자산운용이 미국 대표지수 TR ETF를 분배형으로 조기 전환했다.삼성자산운용은 지난 24일 ‘KODEX 미국S&P500TR’과 ‘KODEX 미국나스닥100TR’를 각각 ‘KODEX 미국S&P500’, ‘KODEX 미국나스닥100’로 전환했다.이는 기획재정부가 소득세법 시행령 개정을 통해 TR ETF의 분배 유보 범위를 조정한 데 따른 후속 조치다.세법상 집합투자기구(펀드)는 매년 1회 이상 결산 및 분배를 해야 하지만 현행 소득세법 시행령은 ‘지수구성종목 변경을 위한 ETF 거래이익’은 분배를 유보할 수 있는 사유 중 하나로 규정하고 있었다. 그간 운용업계는 분배금 재투자가 ETF 기초지수의 구성 종목 변경에 해당한다고 해석해 TR형 상품을 출시해 왔다. 분배금의 재투자를 통해 복리 효과와 과세 이연 효과를 누릴 수 있단 점이 일반적으로 분배금을 지급하는 프라이스리턴(PR) 상품과 차별점으로 꼽혔다.특히 삼성운용은 TR ETF의 복리 효과를 적극적으로 홍보하며 KODEX 미국S&P500TR의 순자산을 전체 해외 주식형 TR ETF 가운데 가장 큰 규모로 키웠다. KODEX 미국S&P500, KODEX 미국나스닥100의 순자산 규모는 각각 3조 7000억원, 1조 8000억원에 달한다.그러나 기획재정부가 이자와 배당의 재투자를 종목 교체로 보는 것은 맞지 않다고 판단, 소득세법 시행령의 분배유보 가능 사유 중 ‘지수 구성종목 변경을 위한 ETF 거래이익’에 ‘ETF 거래이익 중 이자·배당은 제외’라고 명시함으로써 TR ETF의 운용에 제동이 걸렸다.시행령 개정안은 오는 7월 1일부터 발생하는 이자 및 배당분부터 적용되지만 삼성운용은 투자자 혼란을 고려해 해외 주식형 TR ETF 2종에 대해 빠르게 전환에 나섰다. 기존 배당 자동 재투자 방식에서 분기 배당 방식으로 배당 방식을 변경해, 1월, 4월, 7월, 10월말일을 기준으로 배당을 실시한다. 해당 상품은 오는 5월 두번째 영업일 첫번째 배당을 지급할 예정이다.변경 후에도 기존의 낮은 총보수는 유지한다. 해당 상품의 총보수는 0.0099%로 동일 유형의 최저 수준이다.김인식 IBK투자증권 연구원은 “TR ETF의 주요 매수 요인에는 저비용에 따른 장기 투자 목적이 자리하고 있다”며 “기존 초저비용 수준을 유지하겠단 입장을 발표하면서 우려가 완화됐다”고 밝혔다.",https://image.edaily.co.kr/images/photo/files/NP/S/2025/02/PS25020100165.jpg,2025-02-01
한국경제,1만2000원에 산 주식 3개월 만에… 깜짝 전망 나온 이 종목 | 한국경제,https://www.hankyung.com/article/202501260723i,"1만2500원 저점(2024년 11월 4일 저가)을 찍은 게 엊그제 같은데, 석 달 만에 3만원(1월 24일 고가 3만1000원)을 돌파했다. 상장 후 최고가인 3만원 돌파 하루 만에 주가가 4.93% 하락했는데, 그럼에도 증권가는 매수 리포트를 내고 있다.1일 기준 코스피 시가총액(5977억원) 338위 SNT에너지 이야기다. 이 회사는 2008년 ㈜S&TC로부터 인적분할을 통해 ㈜S&T홀딩스와 신설회사인 S&TC(현재 SNT에너지)로 구분됐다. 원유 분리 플랜트, 석유화학 플랜트용 주요 설비 및 발전소와 집단 에너지시설용 주요 설비를 설계 및 생산한다. 원유 분리 플랜트 및 석유화학 플랜트의 경우는 공랭식 열교환기가 주력 제품이고 복합화력발전소 및 집단 에너지시설의 경우는 배열회수보일러, 복수기 및 환경 설비로서 질소산화물 저감 장치인 SCR 설비, 원자력 발전소용 주요 기자재 복수기를 설계 및 생산한다.최근 주가 상승엔 LNG(액화천연가스) 프로젝트 증가와 주요 제품인 에어쿨러 생산 확대 등이 꼽힌다. 조정현 IBK투자증권 연구원은 “미국 LNG 터미널 개발 재개에 따른 신규 수주를 기대한다”며 “최근 Rio Grande(시공사 베크텔 에너지) LNG 프로젝트에 에어쿨러를 공급하며 창사 이후 처음으로 미국에 진출했다”고 했다. 그는 “베크텔 에너지가 미국 LNG 터미널 건설 시장의 점유율을 30% 갖고 있는 만큼, 미국 내 신규 LNG 터미널 개발 사이클 속 대규모 신규 수주가 지속될 것이다”고 전망했다. 이어 “사우디아라비아 수주도 기대되는데, 그 이유는 사우디 발주의 약 15~30%가 발전소(2024년 기준 481억달러 발주)에서 비롯되는데 탄소 배출 절감을 위해 기존 중유 발전소를 천연가스 발전소로 전환 중이기 때문이다”고 설명했다.또 “자회사인 SNT걸프는 사우디 담맘 공장에 2차 증설을 완료했다”며 “사우디 국영석유회사 아람코와 전략적 장기조달 구매협약 체결을 통해 MENA(중동·아프리카) 지역 발전설비 시장 공략을 강화하고 있는 만큼 안정적인 신규 수주 물량이 지속될 것이다”고 전망했다.이상헌 iM증권 연구원은 “아람코의 경우 2030년까지 판매 가스 생산량을 2021년 대비 60% 이상 늘리는 것을 목표로 하는 가스 확장 전략을 펼치고 있다”며 “중동·북미 지역 등에서 LNG 생산능력 확대 프로젝트 발주 증가로 SNT에너지 신규 수주도 2022년 1291억원에서 2024년 3분기 누적 4861억원으로 급속히 증가하고 있다”고 분석했다. 지난해 수주잔고는 8000억원이상으로 알려졌다. 이 연구원은 “수주잔고를 기반으로 향후 실적 향상이 예상되고 지속적인 신규 증가로 성장성 또한 가속화될 것이다”고 판단했다. 올해 매출 4431억원, 영업이익 435억원을 전망했다. 전망치가 맞는다면 2019년 매출 2133억원, 영업이익 175억원에서 각각 107.74%, 148.57% 증가하게 되는 것이다.곽민정 현대차증권 연구원은 “지난해 12월 23일 베크텔 에너지와 약 719억원 규모 에어쿨러 공급계약을 공시했다”며 “트럼프 2기를 맞아 미국 내 계류되었던 LNG 프로젝트들이 재개되기 시작한 후 첫 프로젝트 중 하나라는 점에서 올해 에어쿨러 수주가 가팔라질 것으로 보인다”고 했다. 이어 “SNT에너지는 2022년 KHE 인수 이후 국내 유일의 에어쿨러 업체로서 독점적 성장세가 기대된다”며 목표주가를 3만5000원으로 상향했다. 현 주가(1일 2만8900원) 대비 21.11% 상승 여력이 있는 셈이다.또 “지난해 4분기 매출 957억원(전년 동기 대비 8.4% 증가), 영업이익 90억원(25.4% 증가)으로 호실적을 기록했다”며 “특히 우호적인 환율 효과로 세전이익은 242억원을 기록해 국내 유일의 에어쿨러 업체로 높은 성장세를 보여줄 것으로 기대한다”고 했다. 이어 “북미 지역의 AI 데이터 센터의 새로운 전력 수요를 충족하기 위해 향후 4~5년간 최소 2만MW의 LNG 복합화력발전이 필요하다”며 SNT에너지의 수혜를 예상했다.",https://img.hankyung.com/photo/202501/01.39330636.1.jpg,2025-02-01
머니투데이,"""불황 수혜주라며"" 돌변한 이 주식…1억원 투자, 5700만원 남았다 - 머니투데이",http://news.mt.co.kr/mtview.php?no=2025013113585587893,"대표 편의점주로 꼽히는주가가 연일 신저가를 경신한다. 장기간 이어지던 주가 하락세는 호텔 사업부와의 인적분할을 계기로 더 가속이 붙었다. 증권가에서는 여전히 수익성 개선의 가시성이 낮다면서 실적 추정치와 함께 목표가를 내리는 추세다.지난달 31일 코스피에서 GS리테일은 전 거래일 대비 20원(0.13%) 내린 1만5300원에 마감했다. 이날 GS리테일은 장중 1만5140원을 기록하며 역대 최저가를 경신했다. 주가는 올해 들어서만 10.74% 하락했고 1년 전, 5년 전과 비교해도 각각 31.39%, 61.41% 낮은 수준이다.주가가 연일 최저가를 찍자 손실 투자자도 크게 늘었다. NH투자증권 통계에 따르면 지난 23일 기준 GS리테일 투자자의 손실 투자자 비율은 100%다. 이 증권사를 통해 투자한 투자자의 평균 수익률은 마이너스(-)42.47%다. 투자자가 1억원을 투자했다면 평균 5700만원가량 남은 셈이다.주가 하락은 인적분할을 계기로 가속화됐다. GS리테일은 지난해 6월3일 유통 사업과 호텔 사업의 인적 분할을 결정했다. GS리테일은 본업인 유통업에, GS P&L(GS피앤엘)은 호텔 사업에 주력해 기업가치를 제고하기 위함이었다. 그러나 인적분할로 인한 거래정지일부터 이날까지 주가는 33.9% 내렸다.증권가는 추가적인 사업 구조 개편이 필요하다고 본다. 백재승 삼성증권 연구원은 ""인적 분할로 유통 사업에 대한 집중을 선택했지만, 여전히 회사가 영위하는 다양한 사업들의 시너지 창출 효과가 크지 않아 보인다""라며 ""부동산 개발 사업을 포함해 전사 실적에 대한 기여가 크지 않은 다양한 연결 및 지분법 대상 자회사에 대한 구조조정 노력이 계속될 필요가 있다""고 했다.주가가 대폭 낮아졌지만 GS리테일에 대한 눈높이는 여전히 낮아지는 중이다. 이달 GS리테일에 대해 분석 보고서를 낸 증권사 8곳 중 7곳이 주당순이익(EPS)을 하향 조정하며 목표가를 내렸다. 이 중 3곳은 GS리테일의 지난해 4분기 영업이익이 전년 동기 대비 40%대 하락하며 시장 기대치를 큰 폭으로 하회할 것으로 전망했다.남성현 IBK투자증권 연구원은 ""GS리테일의 4분기 영업이익은 523억원(전년 동기 대비 -42.7%)을 기록하며 시장 기대치를 큰 폭으로 하회할 것""이라며 이유로 인적분할 결정에 따른 사업부 제외, 소비경기 위축과 비우호적 날씨에 따른 홈쇼핑 부진, 편의점 고정비, 개발사업부 프로젝트 부진 등을 꼽았다.주가 재평가를 위해서는 시장과의 소통이 필수적이라는 지적이다. 박종렬 흥국증권 연구원은 ""부실한 실적 모멘텀과 함께 분할 이후 기업가치 제고에 대한 시장과의 소통 부족이 주가 하락 요인으로 작용했다""라며 ""이른 시일 내 밸류업 공시를 통해 보다 구체적으로 기업의 향후 성장성과 주주환원 등 주주가치 제고 노력에 대해 소통할 필요가 있다""고 했다.",https://thumb.mt.co.kr/06/2025/01/2025013113585587893_2.jpg/dims/optimize/,2025-02-01
머니투데이,"""비행기 못 타겠어요""…이륙하다 다시 휘청인 항공주 - 머니투데이",http://news.mt.co.kr/mtview.php?no=2025013115490945333,"설 황금연휴를 거쳐 반등을 모색해온 LCC(저비용항공사) 등 항공관련주가 또 한번의 악재를 맞았다.참사 한달여만에화재 사고로 항공기 이용 불안심리가 커진 영향으로 분석된다.지난달 31일 한국거래소에 따르면 코스피 상장사 에어부산은 이날 2395원에 거래가 마감됐다. 전 거래일인 1월 24일 대비 3.23% 하락했다. 에어부산 외에도(-2.91%), 제주항공(-0.94%),(-1.09%) 등 LCC 관련주가 모두 하락세로 마감했다. 경영권 분쟁으로 급등했던과도 각각 5.11%, 5.54% 급락했다. 대형항공사를 제외한 대부분의 LCC가 설 연휴가 끝나기 무섭게 하락세로 돌아선 것이다.항공기업의 주가 약세는 지난달 28일 부산 김해공항에서 홍콩으로 가려던 에어부산 BX391편에서 화재가 발생한 영향이다. 항공기 동체 상부를 태운 불은 인명피해 없이 전소됐지만 거듭된 항공기 사고로 인해 승객의 불안심리는 한층 가중됐다. 인명사고가 없고 화재사고 원인이 기내에 반입된 휴대용 배터리에서 발생한 것으로 예측되면서 가격 하락폭은 제한적이었다. 그러나 이륙 후 같은 상황이 발생한다면 더 큰 피해가 발생할 수 있어 해소되지 않은 리스크라는 지적도 있다.지난해 항공관련주는 티메프(티몬·위메프) 미정산 사태로 부진을 면치 못하다 원/달러 환율 급등까지 겹치면서 연말 대목에도 하락세를 이어갔다. 환율 급등은 해외여행 수요 위축을 불러올 뿐 아니라 달러로 지불하는 항공기 리스비와 유류비 인상도 초래해 항공주에 악재다.여기에 제주항공 참사까지 발생하면서 연초까지 저공비행이 이어졌다. 인천국제공항 출국 보안검색 규정강화와 심사인원 부족 문제도 해외여행을 꺼리는 심리를 부채질 했다. 그나마 대체공휴일 지정으로 설 연휴기간 105만명이 해외에 출국하는 역대 최다 기록을 세운 영향으로 주가는 바닥을 찍는듯 했다. 하지만 거듭된 항공기 사고로 소비자 불안심리가 주가에 반영되는 모습이다. 지난해 12월29일 179명의 사망자를 낸 제주항공 참사가 발생한지 불과 한 달만에 벌어진 사고다. 전날 미국 워싱턴DC에서 발생한 항공기와 헬기 충돌사고까지 발생하면서 이런 심리는 가중됐다.증권업계도 항공주의 단기적 회복은 어렵다는 판단이다. 최고운 한국투자증권 애널리스트는 ""항공기 안전 문제와 소비자 불안은 어느 항공사나 자유롭지 못하다""며 ""정확한 사고원인을 규명하려면 최소 6개월에서 1년이 걸리지만 사회적 불안감 해소는 이보다 더 긴 시간이 걸릴 수 있다""고 평가했다.",https://thumb.mt.co.kr/06/2025/01/2025013115490945333_1.jpg/dims/optimize/,2025-02-01
이데일리,코스피 주간 외국인 순매수 1위 'NAVER',http://www.edaily.co.kr/news/newspath.asp?newsid=01256246642066584,[이데일리 신하연 기자],https://image.edaily.co.kr/images/photo/files/NP/S/2025/02/PS25020200073.jpg,2025-02-02
이데일리,코스피 주간 개인 순매도 1위 'NAVER',http://www.edaily.co.kr/news/newspath.asp?newsid=01266086642066584,[이데일리 신하연 기자],https://image.edaily.co.kr/images/photo/files/NP/S/2025/02/PS25020200076.jpg,2025-02-02
이데일리,코스피 주간 기관 순매수 1위 '삼성전자',http://www.edaily.co.kr/news/newspath.asp?newsid=01269366642066584,[이데일리 신하연 기자],https://image.edaily.co.kr/images/photo/files/NP/S/2025/02/PS25020200077.jpg,2025-02-02
이데일리,코스피 주간 개인 순매수 1위 '삼성전자',http://www.edaily.co.kr/news/newspath.asp?newsid=01262806642066584,[이데일리 신하연 기자],https://image.edaily.co.kr/images/photo/files/NP/S/2025/02/PS25020200075.jpg,2025-02-02
이데일리,코스피 주간 기관 순매도 1위 '한미반도체',http://www.edaily.co.kr/news/newspath.asp?newsid=01272646642066584,[이데일리 신하연 기자],https://image.edaily.co.kr/images/photo/files/NP/S/2025/02/PS25020200078.jpg,2025-02-02
이데일리,코스피 주간 외국인 순매도 1위 '삼성전자',http://www.edaily.co.kr/news/newspath.asp?newsid=01259526642066584,[이데일리 신하연 기자],https://image.edaily.co.kr/images/photo/files/NP/S/2025/02/PS25020200074.jpg,2025-02-02
이데일리,'딥시크 쇼크'에 韓 증시도 출렁…2월 주도주 바뀔까,http://www.edaily.co.kr/news/newspath.asp?newsid=01859766642066584,"[이데일리 신하연 기자] 최근 중국 인공지능(AI) 스타트업 딥시크가 저비용으로 고성능을 발휘하는 AI 모델을 공개하면서 글로벌 증시가 요동치고 있다. 반도체나 전력설비 같은 하드웨어에 쏠려있던 AI 투자가 소프트웨어 중심으로 이동하는 계기가 될 것이란 분석도 나온다.2일 엠피닥터에 따르면 긴 설 연휴(1월27~30일)를 마치고 지난달 31일 개장한 코스피는 딥시크 쇼크를 뒤늦게 반영하며 약세를 보였다. 이날 SK하이닉스(000660)는 9.86% 급락하면서 하루 만에 시가총액 15조원이 증발했고, 삼성전자(005930)도 2.42% 하락하면서 전체 지수에 부담을 줬다.최근 도널드 트럼프 미국 대통령의 대규모 AI 인프라 투자 계획에 랠리를 이어오던 전력설비 관련주들도 일제히 약세로 돌아섰다. 가온전선(000500)은 전거래일 대비 11.32% 빠진 6만 300원에 거래를 마쳤다. 효성중공업(298040)(-11.71%), 일진전기(103590)(-10.21%), 제일일렉트릭(199820)(-10.04%), 제룡전기(033100)(-9.02%), HD현대일렉트릭(267260)(-7.87%), 세명전기(017510)(-7.40%), LS ELECTRIC(010120)(-5.33%) 등이 동반 하락했다.대규모 AI 인프라 투자에 대한 회의감이 커진 영향이다. 딥시크의 인공지능 모델 ‘R1’은 수학, 코딩, 자연어 추론 등에서 오픈AI의 ‘o1’ 모델과 대등한 성능을 보이면서도 개발 비용은 훨씬 저렴한 것으로 알려졌다. 딥시크는 R1 개발에 약 557만달러(약 79억원)를 투입했다고 밝혔는데, 이는 오픈AI나 메타 등 미국의 AI 기업과 비교해 약 95% 저렴한 수준이다. 특히 비교적 저사양의 그래픽처리장치(GPU)인 엔비디아의 ‘H20’과 ‘H800’을 활용해 고성능 GPU 없이도 높은 수준의 AI 모델 개발이 가능함을 보여준 셈이다.이들 종목에서 빠져나온 자금은 소프트웨어 AI 관련 종목으로 이동하는 분위기다. 실제로 대표적인 소프트웨어 종목인 NAVER(035420)(네이버)와 카카오(035720)는 이날 각각 6.13%, 7.27%씩 오르며 딥시크의 저비용 AI 모델이 국내 기업들의 AI 개발을 촉진시킬 것이란 기대감을 반영했다.코스닥에서도 AI 챗봇 관련 종목이 급등했다. 플리토(300080)는 가격 상한가(29.91%)까지 올랐고, 코난테크놀로지(402030)(24.45%), 인스웨이브시스템즈(450520)(22.68%), 솔트룩스(304100)(18.16%), 바이브컴퍼니(301300)(16.54%), 마음AI(377480)(13.15%),  이스트소프트(047560)(11.24%) 등이 큰 폭으로 상승했다. 최승호 상상인증권 연구원은 “국내 인터넷 업종은 오픈소스 진영에 속하기 때문에 오픈소스 모델의 성공이 낙수 효과로 이어질 것”이라고 분석했다.미국에서도 딥시크가 등장한 지난 27일(현지시간) AI 반도체 대장주로 꼽혀온 엔비디아가 하루 만에 17% 폭락, 현재까지(31일 종가 기준)도 3.82% 내리며 약세를 보인 반면 AI 사업부문에서 실제로 견조한 실적을 내고 있는 메타의 경우 같은 기간 주가가 오히려 10%가량 상승한 것도 비슷한 맥락이다.전문가들도 기존 미국 빅테크와 하드웨어 중심이었던 AI 랠리에서 내러티브 변화가 나타날 수 있다는 진단을 내놓고 있다. 딥시크의 등장으로 AI 투자가 둔화하기보다는 오히려 다양한 후발주자들의 도전이 나타날 수 있다는 것이다. 권순호 IBK투자증권 연구원은 “이번 딥시크 AI 출현과 함께 후발주자들이 비용 효율적으로 상용화 가능성 있는 AI 모델을 개발할 수 있는 환경을 마련했다”며 “국내 기업들도 팔로워로써 AI 생태계 재진입 기대감이 나타날 것”이라고 전망했다.이은택 KB증권 연구원은 “딥시크 쇼크 이후 증시 반응을 보면 단순히 하드 AI가 하락한 뒤 끝나는 것이 아니라 투자자금이 AI를 활용하는 소프트웨어 등 ‘소프트 AI’로 이동하는 모습이 확연히 나타난다”며 “(딥시크 쇼크가) 단기 충격을 주거나 최악의 경우 일부 B2B(기업간거래) 투자를 둔화시킬 수 있으나 B2C(기업과 소비자 간 거래)가 반등할 것이기 때문에 전체 사이클을 꺾기는 어려울 것”이라고 내다봤다.",https://image.edaily.co.kr/images/photo/files/NP/S/2025/02/PS25020200448.jpg,2025-02-02
이데일리,은행 '테마형 ETF 판매' 쏠림…보유금액 70%가 테마형 상품,http://www.edaily.co.kr/news/newspath.asp?newsid=01872886642066584,"[이데일리 신하연 기자]은행의 ‘테마형 상장지수펀드(ETF) 판매’ 쏠림 현상이 투자자에게 미칠 리스크를 면밀히 살펴야 한다는 지적이 나왔다. 최근 ETF 시장에서 인공지능(AI), 반도체 등 특정 업종이나 테마를 반영한 상품이 급증하는 가운데 은행이 특정금전신탁 상품을 통해 편입하는 ETF의 약 70%가 이같은 테마형 상품에 쏠려있다는 분석이 나오면서다. 최근 금융당국이 검토 중인 은행의 주가연계증권(ELS) 판매 제한 방안 역시 유사한 맥락에서 나온 바 있다.2일 자본시장연구원이 최근 발간한 ‘ETF시장의 ETF시장의 상품구조 변화와 시사점’ 보고서에 따르면 은행 전체 ETF 보유 금액 총 10조9000억원 중 약 70%가 국내·해외 주식 ETF의 특정 테마·업종형에 집중돼 있다.구체적으로 은행을 통한 해외주식형 ETF의 경우 특수유형 보유액이 2조4000억원으로 대표지수형(1조6000억원)보다 50% 많았다. 국내주식 ETF에서는 특수유형 보유액이 5조1000억원으로 대표지수형(7000억원)의 629%에 달해 은행의 테마형 쏠림 현상이 더 큰 것으로 나타났다.보고서는 이러한 현상이 은행의 판매 전략과 밀접한 관련이 있다고 짚었다. 보고서는 “신탁을 통해 특정 ETF를 편입하는 경우, 목표 수익률에 도달하면 자동으로 해지되는 특약이 포함된 상품이 많다”며 “변동성이 높은 테마형 ETF의 경우 빠른 해지가 가능해 계약 회전율이 높아지고, 이에 따라 은행이 수취하는 선취 신탁보수도 증가하는 구조”라고 분석했다. 또 2차전지, 반도체, 빅테크 등 시장에서 주목받는 업종과 테마는 마케팅 측면에서 개인투자자의 관심을 끌기에도 유리하다.실제로 과거에도 은행들은 레버리지·인버스형 ETF를 활용해 신탁 상품을 대거 판매한 전례가 있다. 2017~2018년에 은행들은 자동해지특약이 있는 ETF 신탁에 레버리지 ETF를 대거 편입했고, 이에 대해 금융감독원이 소비자 경보를 발령해 그 위험성을 지적한 바 있다.테마형 ETF는 주식시장 내 특정 업종이나 테마의 변동성을 크게 반영하는 상품이기 때문에, 코스피200, 미국 S&P500 등 시장대표지수보다 손실 가능성이 크다. 은행이 이러한 상품을 집중적으로 판매할 경우, 특정 테마가 시장에서 인기를 끌 때 자금이 몰렸다가 반대로 시장 분위기가 바뀌면 급격한 자금 이탈이 발생할 위험이 커질 수 있다.특히 신탁은 고객이 지시하고 금융사가 대신 운용해주는 상품이지만, 실제 고객이 직접 투자를 지시하기보다 은행 창구에서 제시하는 상품 포트폴리오 전략을 보고 직원 권유에 따라 운용하는 경우가 대부분이다.이에 따라 금융당국이 은행의 테마형 ETF 판매 행태를 모니터링하고, 투자자 보호를 위한 조치를 강화해야 한다는 제언이 나온다. 유행하는 특정 유형 ETF시장에서의 과다한 마케팅 경쟁이 없는지 확인하는 한편 새롭게 설계된 혁신적인 ETF에 대해서는 상장심사 단계에서 내재된 위험을 파악하고 투자자와 자산운용사 간 역학관계 분석을 통해 시장에 미칠 영향을 분석해야한다는 설명이다.김재칠 자본시장연구원 펀드·연금실 선임연구위원은 “ETF 시장의 상품구조 변화는 자산운용사 및 투자자 모두에게 긍정적인 기능을 제공하지만 특정유형으로 너무 큰 자금이 쏠리고 자산가치가 크게 하락할 경우 ETF시장 및 자산운용사 신뢰도 저하 문제를 초래할 수 있다”며 “이를 방지하기 위한 자산운용사 및 금융당국의 적극적인 노력이 필요하다”고 제언했다.",https://image.edaily.co.kr/images/photo/files/NP/S/2025/02/PS25020200369.jpg,2025-02-02
