name,title,link,content,img,date
머니투데이,"상장 첫날 10% 빠진 LG씨엔에스…""공모가 비쌌다"" 터져나온 한탄 - 머니투데이",http://news.mt.co.kr/mtview.php?no=2025020514352310398,"올해 IPO(기업공개) 대어로 기대를 받던가 코스피 상장 첫날 10% 가까이 고꾸라졌다. 금융투자업계 전문가들은 이번에도 가격이 문제였다고 지적한다. 상장만 하면 '따블(공모가 대비 주가 2배)'을 하던 과거와 시장 상황이 달라졌다는 것이다. 금융감독원도 합리적인 공모가 산정을 위한 개선책을 마련해 시행할 계획이다.5일 한국거래소에 따르면 이날 상장한 LG씨엔에스는 공모가(6만1900원) 대비 6100원(9.85%) 하락한 5만5800원에 거래를 마쳤다.LG씨엔에스 공모액은 1조1994억원이다. 2022년상장 이후 3년 만에 이뤄진 조단위 IPO로, 시장의 주목을 끌었다. 지난달 9일부터 15일까지 진행된 수요예측에서는 국내외 기관 총 2059곳이 참여해 114대1의 경쟁률을 기록했다. 최종 공모가도 희망 공모가액 최상단인 6만1900원에 확정됐다. 지난달 21일부터 22일 양일간 일반투자자를 대상으로 공모주 청약을 실시한 결과 21조원이 넘는 청약 증거금이 몰렸다.그러나 시장은 냉정했다. 이날 개장하자마자 LG씨엔에스는 공모가를 밑도는 6만500원을 기록했다. 장 중 5만4900원까지 미끄러지기도 했다.익명을 요구한 금융투자업계 관계자는 ""LG씨엔에스의 주가가 하락한 것은 공모가가 비쌌기 때문""이라며 ""3년 만에 이뤄지는 조단위 IPO이자, 올해 첫 대어이다 보니 공모가가 높게 형성됐다""고 지적했다.이어 ""LG씨엔에스의 공모가가 최상단인 6만1900원에 결정됐는데, 경쟁사인와 비교하면 부담스러운 수준""이라고 설명했다.LG씨엔에스의 2023년 연결 기준 영업이익은 4640억원으로 경쟁사인 삼성에스디에스의 영업이익(8082억원)의 절반 수준이다. 그러나 이날 종가 기준 LG씨엔에스의 시가총액은 5조4062억원으로 삼성에스디에스의 시가총액 9조8502억원의 절반을 넘는다.LG씨엔에스의 주식 의무 보유 미확약 비율이 높았던 점도 주가 하락에 한몫했다. LG씨엔에스 수요 예측에 참여한 2059곳의 기관 중 의무보유 미확약 기업은 1741곳에 달한다.LG씨엔에스를 포함해 올해 상장한 새내기주 8곳(스팩·재상장·이전상장 제외) 중 7곳의 주가가 공모가를 크게 밑돌고 있다.의 이날 종가는 1만230원으로 공모가(1만9000원) 대비 46.16% 하락했다. 공모가 대비 주가가 하락한 기업은(공모가 대비 5일 종가 등락률 -44.08%),(-39%),(-26.06%),(-12.20%),(-8.28%)등이다.전문가들은 새내기주들의 주가가 하락한 원인으로 비싼 공모가를 지목한다. 지난해부터 국내 증시를 둘러싼 시장 상황이 나빠지면서 시장이 더욱 냉정해지고, 기대감만으로 새내기주들이 따블을 기록하기 어려워졌다는 진단이 나온다.금융투자업계 관계자는 ""올해 공모주들이 치열하게 공모가를 정하지 않으면 큰코를 다치게 될 것""이라고 경고했다.상황이 이렇자 금융당국도 나섰다. 이날 이복현 금융감독원장은 서울 서대문구 한국공인회계사회관에서 국내 상장사를 감사하는 9개 회계법인 CEO(최고경영자)와 간담회를 갖고 ""상장 과정에서 매출 급감 사실을 숨기는 등 부정한 수단으로 가치를 부풀리는 기업의 자본시장 진입을 차단하기 위해 IPO 예정 기업에 대한 사전 회계심사를 확대하겠다""며 ""상장 직후 주가가 공모가를 크게 하회하고 매출 등 영업실적이 급감한 기업에 대해서는 사후 심사·감리를 강화하겠다""고 말했다.앞서 지난달 21일에는 오는 4월부터 순차적으로 의무보유 확약 기관을 확대하고, 수요예측 참여자격을 강화하는 등 합리적인 공모가 산정을 위한 IPO 시장 개선 방안을 내놓기도 했다.업계 관계자 A씨는 ""의모보유 확약 기간 확대와 적격 투자기관 검증 강화 등과 같은 규제는 상장 직후 기관 투자자들의 투기성 매도 형태를 줄이는데 도움이 될 것으로 판단한다""며 ""상장 기업의 회계 감독 강화는 무분별한 기업들의 상장을 방지하고 건전한 기업들의 상장을 지원한다는 측면에서 긍정적으로 보인다""고 했다.",https://thumb.mt.co.kr/06/2025/02/2025020514352310398_1.jpg/dims/optimize/,2025-02-05
머니투데이,"상폐 기업 5곳 중 1곳 '결산 관련 사유'…""투자자 유의 필요"" - 머니투데이",http://news.mt.co.kr/mtview.php?no=2025020514063595903,"한국거래소는 최근 5년간 상장폐지된 기업의 21%가 결산 관련 사유로 퇴출됐다고 밝혔다.5일 한국거래소의 '2024 사업연도 결산 관련 시장참가자 유의사항'에 따르면 최근 5년(2020~2024년) 코스피와 코스닥 시장에서 상장폐지된 기업은 총 212개사다. 이중 결산 관련 사유로 상폐된 기업은 45개사로 21.2%를 차지했다.한국거래소는 ""상장 법인의 감사보고서는 투자 판단에 중요 정보를 포함하고 시장 조치를 수반할 수 있어 보고서 수령 즉시 이를 공시해야 한다""며 ""주주총회 1주 전까지 주주에게 감사보고서·사업보고서를 제공해야 한다""고 말했다.투자자들의 주의도 필요하다고 강조했다. 결산 시기에는 투자 관련 중요 공시가 집중되고 상장폐지 등 중요한 시장 조치가 수반돼 예상치 못한 손실이 발생할 수 있기 때문이다. 경영 안정성이 미흡하거나 재무 상태가 불안정한 기업을 유의해야 한다.거래소는 ""감사보고서 제출 관련 외부감사인 등과의 협조체계를 구축해 신속한 공시유도 및 감사의견 비적정 기업에 대한 적시 시장 조치를 취하는 등 투자자 보호를 위해 만전을 기하겠다""고 밝혔다.",https://thumb.mt.co.kr/06/2025/02/2025020514063595903_1.jpg/dims/optimize/,2025-02-05
머니투데이,오픈AI 협업에 사상 최대 실적까지…카카오그룹주 동반 강세 - 머니투데이,http://news.mt.co.kr/mtview.php?no=2025020514213833734,"오픈AI와 전략적 제휴를 맺은 카카오 주가가 강세를 보인다. 지난해 사상 최대 실적을 낸 카카오뱅크 등 카카오그룹주가 동반 강세다.5일 오후 2시10분 기준 코스피 시장에서는 전일 대비 2150원(5.26%) 오른 4만3000원에 거래되고 있다.카카오는 국내 기업 중에는 최초로 오픈AI와 전략적 제휴를 체결했다. 양사는 앞으로 AI(인공지능) 서비스 고도화를 위한 기술 협력, 공동 상품 개발을 추진할 계획이다.카카오그룹주도 덩달아 강세를 보인다. 같은 시각는 전일 대비 1400원(6.57%) 오른 2만2700원,는 2650원(9.06%) 오른 3만1900원에 거래되고 있다.카카오뱅크는 이날 2024년 당기순이익이 전년 대비 24% 증가한 4401억원을 기록하며 역대 최대 실적을 냈다고 밝혔다. 영업이익은 같은 기간 26.8% 늘어난 6069억원을 기록했다고 공시했다.",https://thumb.mt.co.kr/06/2025/02/2025020514213833734_1.jpg/dims/optimize/,2025-02-05
머니투데이,"빗썸 최대주주 비덴트, 회계기준 위반으로 과징금 '51억' - 머니투데이",http://news.mt.co.kr/mtview.php?no=2025020518252853520,"가 회계기준 위반 혐의로 과징금 51억원을 부과받았다.금융위원회는 5일 제2차 회의를 열고 회계처리기준을 위반해 재무제표를 작성·공시한 비덴트에 대해 과징금 46억5000만원을 의결했다고 밝혔다. 전 대표이사 등 2명에게는 5억2000만원을 부과했다. 총 과징금 규모는 51억7000만원에 달한다.금융위 산하 증권선물위원회는 지난해 비덴트에 대해 감사인 지정 3년과 검찰통보 조치 등을 결정했다. 특수관계자 주석 미기재, 파생상품 부채 미계상 등에 따른 조치다. 회사와 함께 전 대표이사와 전 담당임원을 검찰에 통보했다.더불어 업무집행 지시자에 대해서도 검찰에 고발했다. 업무집행 지시자는 빗썸 관계사의 실소유주 의혹을 받은 강종현씨로 전해진다. 증선위 의결에 따르면 비덴트는 업무집행 지시자가 차명 보유한 주식을 매수하고, 업무집행 지시자가 공동지배하고 있는 회사와 자금·상거래를 했다. 그런데도 이를 특수관계자 거래 주석에 기재하지 않은 것으로 조사됐다. (☞본지 2024년 11월7일 보도 참고금융감독원에 따르면 빗썸의 최대주주는 지분 73.56%를 가진 빗썸홀딩스로, 빗썸홀딩스의 최대주주가 비덴트다. 빗썸홀딩스 지분 34.22%를 보유했다.비덴트 감사업무를 수행한 대현회계법인은 과징금 2억6000만원을 부과받았다.분식회계 혐의가 적발된 코스피 상장사에 대해서는 회사에 과징금 42억4000만원, 전 대표이사 등 3명에게는 10억5000만원을 의결했다. 감사절차를 소홀히 한 신한회계법인은 과징금 1억8000만원이 결정됐다.DI동일은 2015년부터 2019년까지 연결대상 종속회사가 아닌 회사를 연결대상에 포함해 자기자본과 수익·비용 등을 과대계상한 것으로 조사됐다. 증선위는 지난해 회사와 전 대표이사, 전 담당임원 등을 검찰에 고발했다.특수관계자거래 주석을 누락한 대한토지신탁에 대해서는 회사와 전 담담임원에 대해 과징금 1억원과 700만원을 각각 부과했다.",https://thumb.mt.co.kr/06/2025/02/2025020518252853520_1.jpg/dims/optimize/,2025-02-05
머니투데이,"[단독]쥐꼬리 퇴직연금 끝?…""주식에 100% 투자"" 개편 시동 - 머니투데이",http://news.mt.co.kr/mtview.php?no=2025020411184782731,"4일 금융당국에 따르면 금감원은 퇴직연금 적립금 운용시 70%로 설정된 위험자산 총 투자한도를 폐지하고, 국내 주식투자를 허용하는 제도개선안을 추진 중이다. 금융위원회와 금융감독원과 기획재정부, 관할 정부부처인 고용노동부 등으로 구성된 정부 사적연금개선TF(태스크포스)에서 이같은 내용이 논의되고 있다.퇴직연금은 확정급여형(DB), 확정기여형(DC), 개인형(IRP)으로 나뉘는데 금융당국은 우선 개인형 퇴직연금에 대해 위험자산 투자한도 폐지를 건의한 상태다. IRP는 가입자 선택에 따라 퇴직일시금이나 따로 자금을 적립해 운용하는 형태이기 때문에 제한을 둘 필요가 없다는 측면에서다. 당국은 근로자가 적립금 운용방법을 결정하는 DC형에 대해서도 단계적으로 개선안이 반영되도록 한다는 계획이다.현행법상 퇴직연금은 예금과 같은 원리금 보장성 상품뿐 아니라 펀드·지분증권 등 금융투자상품에도 투자할 수 있다. 하지만 원리금이 보장되지 않는 금융투자상품의 경우 위험자산으로 분류해 전체 적립금의 70%를 넘지 못하도록 투자 한도를 정해뒀다. DB·DC·IRP 모두 공통으로 적용된다. 여기에 더해 국내 개별 주식 투자도 불가능하다.그런데 금감원이 추진 중인 제도개선안이 실현될 경우 퇴직연금 적립금을 주식에 100%까지 투자할 수 있는 길이 열린다. 다만 개별 주식투자의 경우 코스피200 종목 등으로 투자 대상을 한정하는 방안을 검토 중이다.금감원은 퇴직연금 수익률을 높이기 위해 이같은 제도개선을 계획했다. 퇴직연금 수익률 제고를 당국이 우선 과제로 삼은 건 일단 수익률이 너무 낮기 때문이다. 현재 최근 10년 기준으로 퇴직연금 연평균 수익률은 2%대에 머물러 있다. 물가 상승률을 감안하면 사실상 마이너스다. 금융투자상품에 투자하기보다는 원리금이 보장되는 예금에 치중된 탓이다.이번 대책에는 이대로라면 노후 대비라는 본연의 역할을 하지 못한다는 위기감이 반영됐다. 시장에선 노후 대비자금을 불리기 위해 수익률을 극대화하는 방향으로 퇴직연금 적립금을 운용하는 가입자들이 적지 않은데, 현행 규제가 가입자들의 요구를 따라가지 못하고 있다는 지적도 꾸준했다.퇴직연금 적립금으로 주식 투자가 가능해지면 장기 투자가 활성화된다는 이점도 있다. 장기투자 자금이 주식시장에 안정적으로 유입된다는 측면에서다.금감원은 퇴직연금 수익률을 높이기 위해 지난해 12월 조직개편을 통해 연금감독실을 민생금융 산하에서 금융투자 부문으로 옮기는 등 조직 개편도 시행했다. 금감원은 ""지난해 퇴직연금 적립금이 430조원 규모로 가파르게 성장하는 등 중요성이 커지고 있지만 관심은 저조한 상태""라며 ""개인 선택에 따라 수익률을 높일 수 있는 환경은 만들어줘야 한다고 보고 제도개선안을 추진하고 있다""고 말했다.",https://thumb.mt.co.kr/06/2025/02/2025020411184782731_1.jpg/dims/optimize/,2025-02-05
머니투데이,양도소득세 신고·납부 28일까지…미리채움서비스로 '간단히' - 머니투데이,http://news.mt.co.kr/mtview.php?no=2025020422103575708,"미래채움서비스로 주식 양도소득세 신고가 편리해진다.국세청은 2024년 하반기(7월∼12월)에 국내주식을 양도한 개인이 과세대상에 해당하는 경우 오는 28일까지 주식 양도소득세를 예정신고·납부해야 한다고 5일 밝혔다.신고대상은 △상장주식을 양도한 대주주 △상장주식을 장외거래한 소액주주 △비상장주식을 양도한 주주(중소·중견기업 주식을 K-OTC)시장에서 거래한 일부 주주를 제외)다.우선 대상인상장법인 대주주는 지분율 1%(코스피)·2%(코스닥)·4%(코넥스) 이상 또는 시가총액 50억원 이상인 경우 상장법인 대주주다.양도일이 속하는 사업연도의 직전 사업연도 종료일 현재 지분율 또는 시가총액이 대주주 요건을 충족하거나 직전 사업연도 종료일 이후 주식을 취득해 지분율 요건을 충족하면 대주주에 해당한다.국세청은 이에 5일부터 예정신고 대상 중 상장법인 대주주와 K-OTC시장에서 거래한 주주에게 모바일 안내문을 발송한다.수신 거부 등으로 모바일 안내문을 받을 수 없거나 모바일 안내문 발송에 실패한 경우 우편을 통해 안내할 예정이다. 또 납세자가 홈택스·모바일을 통해 더 쉽고 정확하게 신고할 수 있도록 다양한 신고도움 서비스를 제공한다.특히 홈택스 신고화면에 양도내역 불러오기 기능을 신설해 불러온 내역을 클릭하면 신고입력해야 하는 6개 항목(사업자번호, 종목코드 등)이 자동으로 채워지는 '미리채움서비스'를 지원한다.아울러 중소기업·상장주식·대주주 관련 도움자료를 제공해 납세자가 해당여부를 선택하면 세율이 자동 적용되는 '세율선택도우미'를 통해 복잡한 양도세율을 쉽게 선택할 수 있다.다만 제공되는 도움자료는 납세자 신고 편의를 위한 참고용이므로 신고 시 다시 한번 확인 후 선택해야 한다. 취득한 비상장주식이 상장된 후 양도한 경우 상장주식 해당 여부, 연도 중 상장주식 취득해 대주주 지분율 요건 충족하였는지 여부 등 확인 필요해서다.국세청은 ""무·과소신고하는 경우 가산세 등 불이익이 있으니 '성실신고가 최선의 절세'임을 인식하고 성실한 신고를 당부드린다""며 ""앞으로도 납세자가 더 편리하게 신고할 수 있는 환경을 구현해 '일 하나는 제대로 하는, 국민께 인정받는 국세청'이 되도록 노력하겠다""고 밝혔다.",https://thumb.mt.co.kr/06/2025/02/2025020422103575708_1.jpg/dims/optimize/,2025-02-05
머니투데이,지난해 기업 자금조달 회사채 18% 증가…주식은 감소 - 머니투데이,http://news.mt.co.kr/mtview.php?no=2025020417271647310,"지난해 회사채를 통한 국내 기업의 자금 조달은 증가했으나, 주식은 감소한 것으로 집계됐다.5일 금융감독원이 발표한 '2024년 기업 직접금융 조달 실적'에 따르면 주식·회사채 발행 규모는 287조638억원으로 전년대비 17% 증가했다.주식의 경우 기업공개(IPO) 실적은 증가했으나 시설투자 목적 등 대기업의 유상증자가 감소하면서 전년보다 18% 감소했다. 회사채는 금리인하에 따른 차환발행 목적의 일반회사채와 금융채 발행이 늘면서 18% 증가했다.지난해 주식 공모 발행실적은 172건, 8조8205억원이었다. IPO는 116건, 4조1171억원으로 지난해 대비 3건 감소했으나 금액으로는 14% 늘었다. 1000억원 이상 기업공개가 2023년 3건에서 지난해 4건으로 늘었고, 건당 평균 공모금액도 같은 기간 302억원에서 355억원으로 증가한 영향이다. 시장별로 보면 코스피에서 6건·1조2909억원, 코스닥에서 110건·2조8262억원 발행했다.유상증자는 56건, 4조7034억원으로 전년대비 9건, 2조5538억원(35%) 감소했다. 시설투자 등 대기업 유상증자가 전년대비 52% 줄어든 결과다. 운영자금 조달 등 중소기업의 유상증자는 17% 늘었다.회사채 발행실적은 4554건, 278조2433억원이다. 일반회사채는 531건, 49조8911억원으로 전년보다 15% 증가했다. 자금용도를 보면 기존 고금리 채권에 대한 차환발행은 증가했고, 시설자금 용도의 발행 규모와 비중은 감소했다.금융채는 2952건, 212조1436억원으로 지난해보다 21% 증가했다. 금융지주채(96건·12.4조)와 은행채(383건·77조), 기타금융채(2473건·122.7조) 모두 지난해보다 증가했다. 특히 신용카드사(36.4조), 할부금융사(63.8조), 증권사(10.9조) 등 기타금융채 발행 규모와 비중이 크게 늘었다.지난해 말 기준 전체 회사채 잔액은 692조7242억원으로 전년말 대비 8% 증가했다.CP·단기사채 발행 규모는 전년대비 3% 증가한 1303조5250억원이다. CP는 435조1951억원으로 지난해보다 6% 증가했고, 단기사채는 868조3299억원으로 1%대 늘었다. 지난해 말 기준 CP 잔액은 203조430억원, 단기사채는 64조8813억원이다.",https://thumb.mt.co.kr/06/2025/02/2025020417271647310_1.jpg/dims/optimize/,2025-02-05
머니투데이,"밸류업 언제쯤…건설업계 부진한 기업가치 제고 정책, 왜 - 머니투데이",http://news.mt.co.kr/mtview.php?no=2025020415031143211,"정부가 지난해부터 기업 및 주주가치 제고를 목적으로 추진중인 기업 밸류업 프로그램에 건설사들의 참여가 미진하다. 건설 업황 부진으로 수익성 악화가 이어진 데다 유동성 확보가 중요해졌기 때문으로 보인다. 부동산 경기 불확실성은 여전하지만, 일부 대형 건설사 실적이 개선되고 매출·수주 목표를 높여 잡는 점은 긍정적으로 풀이된다.4일 관련업계에 따르면 정부의 기업 밸류업 프로그램 일환인 기업가치 제고 계획 본공시를 낸 기업은 100여개다. 일부 기업에서는 이미 2차 공시 및 분기별 이행 현황 등도 제출하고 있다. 그러나 건설사는 관련 공시가 거의 없다시피 하다. 공기업 한전기술이 공시를 한 바 있지만 10대 대형건설사 등 업계에서는 아직 예고 공시도 나오지 않았다.건설업은 코스피 시장 내 고질적인 저평가 업종 중 하나다. 금융정보업체 에프앤가이드에 따르면 코스피 건설업종 PBR(주가순자산비율)은 △2019년 0.69 △2020년 0.8 △2021년 0.72 △2022년 0.44 △2023년 0.43으로 계속 1을 밑돈다. 그러나 올해에도 건설업계 대형 상장사들은 기업가치 제고계획을 공시할 별다른 계획은 없는 것으로 전해졌다. 일부 기업들이 3개년 주주환원 정책 등을 발표하고 있지만 밸류업 프로그램에 참여 여부는 결정되지 않았다는 설명이다.한 대형 건설사 관계자는 ""올해 밸류업 프로그램 참여 여부에 대해 딱히 말할 수 있는 사항은 없다""고 했다. 건설업계의 참여율이 낮은 이유에 대해서도 ""정확히 어떤 요인이라고 말하기 애매하다""며 즉답을 피했다.시장에서는 건설업계의 밸류업 정책 미참여는 최근 이어지는 부진한 업황 때문으로 풀이한다. 고질적인 저평가를 벗어나기 위해서는 ROE(자기자본이익률)을 높이거나 자본 효율성을 높여야 한다는 지적이 나온다. 즉 수익성을 높여야 하는데, 최근 업황은 부진이 이어지고 있다. 그러자 주주환원에도 상대적으로 미진하다는 평가다.한 증권사 애널리스트는 ""잉여 현금을 주주환원에 쓰기보다는 아무래도 자신들의 유동성 확보가 필요하다""며 ""그런 부분에 대한 고민이 있으니 주주환원에는 소극적일 수밖에 없을 것""이라고 지적했다.건설업계의 실적 악화는 건설사 이익과 매출 중 상당 부분을 차지하는 국내 주택 경기 악화와 연동됐다. 따라서 수익성 강화도 부동산 경기 반등에 영향을 받을 것으로 보이지만 올해까지는 뚜렷한 반등이 어렵다는 전망이다.시장에서는 부동산 사이클이 올해를 바닥으로 2026년부터 상승 전환할 것으로 관측한다. 건설사들은 수익성 강화를 위해 해외 수주에 열을 올리는 것으로 전해졌다. 해외건설협회에 따르면 해외건설 수주액의 전년동기 대비 증감율은 2021년 -13%를 기록했지만 2022년과 2023년 각각 1%, 8% 증가를 기록했다.건설업계에서 일각에서는 주주환원 강화 움직임도 포착된다.는 지난달 23일 3개년 주주환원 정책을 공시했다. 12년만의 배당 재개다. 회사는 3년간(2024~2026년) 지배지분 순이익의 15~20% 수준으로 주주환원을 시행할 계획이라고 밝혔다.이는 연간 영업익 목표를 초과달성하는 등 실적이 개선된 영향이다. 대형 건설사의 올해 매출 및 수주 가이던스 상향 움직임도 눈에 띈다.은 올해 매출액과 수주목표를 각각 30조3873억원, 31조1412억원으로 설정했다. 이는 지난해 목표치인 29조7000억원, 28조9900억원 대비 올려잡은 것이다.",https://thumb.mt.co.kr/06/2025/02/2025020415031143211_1.jpg/dims/optimize/,2025-02-05
이데일리,"코스피, 외국인·기관 매수에 사흘째 상승…2530선 근접",http://www.edaily.co.kr/news/newspath.asp?newsid=03844166642067896,"[이데일리 김경은 기자] 도널드 트럼프 미 대통령의 관세 정책 소강 상태에서 코스피가 외국인과 기관의 저가 매수세에 힘입어 사흘째 상승세를 이어가고 있다.엠피닥터에 따르면 6일 오후 1시 53분 현재 코스피지수는 전일 대비 20.12포인트(0.80%) 오른 2529.39를 기록하고 있다.투자자별 매매동향을 보면 개인이 3845억원 순매도한 반면 외국인과 기관은 각각 1893억원, 1143억원 순매수를 기록했다. 프로그램 매매에서는 차익거래와 비차익거래 모두 매수 우위를 보이며 전체 2040억원의 순매수를 기록 중이다.시가총액 상위 종목 랠리가 이어지는 가운데 종목별 등락은 엇갈린다. 반도체주 삼성전자(005930)는 1.32% 오른 5만3600원에, SK하이닉스(000660)는 2.62% 오른 20만4000원에 거래되고 있다. 삼성바이오로직스(207940)(0.18%), 셀트리온(068270)(1.18%) 등 제약 바이오도 상승거래되고 있지다. 관세 리스크가 잠재된 현대차(005380)(0.00%), 기아(000270)(-0.10%)는 약보합세다.반면 주주가치 환원책 실망감으로 KB금융(105560)(-7.03%)은 이날 급락세를 이어가고 있다. NAVER(035420)(-1.09%), LG에너지솔루션(373220)(-1.59%)은 1%대 하락 중이다.업종별로는 ‘붉닥 볶음면’ 신화를 쓰면서 호실적을 낸 삼양식품(003230)이 15.63% 급등하며 식품·음료 업종이 이날 4% 가까이 오르고 있고, 이밖에 디스플레이패널, 전기장비, 기계, 생명과학 업종도 2%대 강세다. 대부분 업종이 상승 우위를 보인 가운데, 은행 -2.73%, 증권 -1.72% 등 금융주를 비롯해 전기제품 -1.37%, 통신서비스 -0.73% 등은 약세다.538개 종목이 상승 중이며, 350개 종목이 하락세를 보이고 있다.",https://image.edaily.co.kr/images/photo/files/NP/S/2025/02/PS25020601067.jpg,2025-02-06
