name,title,link,content,img,date
머니투데이,"5만전자도 위태?…실적 엎친데 딥시크·관세 덮친 삼전, 주가 어디로 - 머니투데이",http://news.mt.co.kr/mtview.php?no=2025020316101084993,"'5만전자'가 위태롭다.주가는 부진한 실적에 딥시크 충격 등의 여파로 하락세를 이어가고 있다. 외국인 투자자 지분 보유 비율은 약 2년여 만에 50% 아래로 떨어졌다.3일 코스피 시장에서 삼성전자는 전 거래일 대비 1400원(2.67%) 내린 5만1000원에 마감했다. 장중 3%대까지 하락해 5만800원으로 저점을 찍었다. 지난해 11월14일 4만9900원으로 52주 최저가를 기록한 이후 둘째로 낮은 주가다.삼성전자의 외국인 보유 비중은 지난달 31일 장 마감 기준 49.99%로 하락했다. 삼성전자 외국인 보유 비중이 50%를 하회한 것은 2023년 1월12일 이후 약 2년 만이다. 지난달 31일 기준 6개월간 외국인의 삼성전자 순매도 금액은 22조8806억원에 달한다.삼성전자가 지난해 4분기 시장 기대치를 밑도는 실적을 기록한 데 이어 1분기 실적도 부진할 것이라는 전망이 나오며 투자 심리가 악화하고 있다. 삼성전자의 지난 4분기 매출액은 전년 동기 대비 11.8% 증가한 75조8000억원, 영업이익은 같은 기간 130.7% 증가한 6조5000억원을 기록했다. 영업이익이 이전 분기 대비 29.3% 감소하며 시장 전망치였던 7조9710억원에 비해 18%대 감소한 성적을 내놨다.증권가에서는 올해 1분기가 삼성전자의 실적 저점이 될 것으로 보고 있다. 류영호 NH투자증권 연구원은 ""1분기는 모바일 신제품 효과로 MX(모바일경험) 사업부의 선전이 예상되지만, 통상적인 비수기에 더해 HBM(고대역폭메모리)의 공백기로 연간 실적이 저점을 형성할 것""이라고 했다.대외 불확실성도 가중된다. 트럼프 2기 행정부가 캐나다와 멕시코에 25% 관세를 확정하자 두 국가도 보복 관세로 대응하는 등 무역 전쟁이 본격화했다. 삼성전자의 HBM 매출 일부를 중국이 담당하고 있어 미국의 중국 제재 영향도 피해 가기 어려울 전망이다. 박상욱 신영증권 연구원은 ""엔비디아의 중국 고객사에 삼성전자의 HBM이 탑재되는 것으로 추정되고 있다""며 ""미국의 중국 제재 영향으로 1분기 HBM 매출이 감소할 것""이라고 말했다.중국의 AI 스타트업 딥시크 부상으로 삼성전자가 수혜를 볼 수 있다는 일각의 전망에 대해서도 증권가 의견은 갈린다. 김동원 KB증권 연구원은 ""(삼성전자가) 고가의 HBM뿐만 아니라 500만원 수준의 보급형 칩 마하(MACH) 등 가성비 AI에 최적화된 다양한 AI 칩 프로젝트도 동시에 추진하고 있어 향후 저비용 고효율 AI 확산의 수혜가 전망된다""고 봤다.반면 김영건 미래에셋증권 연구원은 ""딥시크 출시로 가속기 스펙의 하향 가능성이 나오며 삼성전자의 기회 요인이 커진다는 기대와는 달리, 딥시크 출시는 가속기 수요 증대로 이어져 삼성전자의 근본적인 선호 요인으로 삼기는 충분하지 않다""고 했다.",https://thumb.mt.co.kr/06/2025/02/2025020316101084993_1.jpg/dims/optimize/,2025-02-03
머니투데이,"""삼성전자 싸다"" 새해에도 개미만 줍줍…외국인 지분율 50% 붕괴 - 머니투데이",http://news.mt.co.kr/mtview.php?no=2025020309033578450,"의 외국인 투자자 지분 보유 비율이 50% 밑으로 떨어졌다.  외국인들은 지난 6개월 동안 삼성전자 주식 22조8806억원어치를 팔아치웠다.3일 한국거래소에 따르면 삼성전자의 외국인 보유 비중은 지난달 31일 장 마감 이후 49.99%로 하락했다. 한국거래소는 장 마감 후 외국인 보유 비중을 계산해 다음 영업일에 공시한다. 삼성전자 외국인 보유 비중이 50%를 하회한 것은 2023년 1월12일 이후 2년 만이다.삼성전자의 외국인 보유 비중은 지난해 7월12일 56.55%에 달했지만 약 6개월 만에 50% 아래로 떨어졌다. 반도체 수요 감소, 삼성전자 실적 부진 등의 우려가 커지면서 외국인들이 주식을 순매도했기 때문이다.지난달 31일 기준 6개월간 외국인의 삼성전자 순매도 금액은 22조8806억원에 달한다. 특히 지난해 8월5일 코스피가 급락했던 블랙먼데이 하루에만 외국인은 삼성전자의 주식을 1조2248억원 순매도했다.외국인들이 삼성전자 주식을 대거 매도한 것은 지난해 반도체 재고조정이 이뤄지고, 삼성전자의 실적도 악화됐기 때문이다. 또한 삼성전자가 AI(인공지능) 주요 부품인 HBM(고대역폭메모리) 납품을 지연하면서 기술력 문제도 불거졌다.이같은 상황에서 지난달 31일 '딥시크 충격'이 국내 증시를 덮쳤고, 외국인은 당일에만 삼성전자 주식 7005억원을 팔았다. 삼성전자의 주가는 5만2400원으로 미끄러졌다.지난 27일 중국 AI 스타트업 딥시크가 미국 빅테크 기업의 10분의 1도 안 되는 비용으로 고성능 AI 모델을 개발했다는 소식이 나왔다. 이에 따라 저비용 첨단 AI 개발로 인해 AI 용 HBM(고대역폭메모리) 시장이 둔화할 수 있다는 우려가 커졌고 미국은 물론 국내 반도체 업체들 주가가 타격을 입었다.다만, 금융투자 업계 전문가들은 삼성전자의 주가가 올해 상반기 내에 회복할 가능성이 있다고 봤다.이종욱 삼성증권 연구원은 ""삼성전자가 기술 경쟁력을 회복했다는 증거가 나오고, 주주 환원 프로그램이 나오면 상반기 중 주가가 회복될 가능성이 높다""며 ""올 1분기 실적은 기대에 못 미칠 수 있으나 분기 이익 바닥이 확인된다는 점에서 긍정적""이라고 했다.",https://thumb.mt.co.kr/06/2025/02/2025020309033578450_1.jpg/dims/optimize/,2025-02-03
머니투데이,"""천문학적 투자 없어도 된다고?""…'딥시크 쇼크', 한국형 AI엔 기회될까 - 머니투데이",http://news.mt.co.kr/mtview.php?no=2025020316083764501,"중국 AI(인공지능) 스타트업 딥시크(DeepSeek)가 공개한 생성형 AI 모델이 '규모(스케일링)의 법칙'을 깨면서 한국형 AI에도 기회가 올 것이라는 기대감이 커진다. 증시에서는 이미 국내 대표 소프트웨어 기업인 네이버()와에 주목하는 분위기다.최근 공개된 중국 AI 딥시크 R1은 글로벌 1위 AI인 챗GPT(ChatGPT)에 비해 저렴한 비용에 뛰어난 성능을 자랑했다. 미국 수학경시대회인 AIME 2024 벤치마크 테스트에서 딥시크는 79.8%의 정확도를 기록해 오픈AI의 o1의 79.2%를 능가했다.딥시크에 주목하는 이유는 무엇보다 놀라운 가성비(가격 대비 성능)다. 딥시크에 따르면 R1 개발에는 약 557만6000달러(약 79억원)를 투입, 메타가 AI 모델 '라마3′에 쓴 비용 10분의 1 수준에 그쳤다. 오픈AI의 챗GPT에 비교하면 18분의 1 수준으로 추정된다.딥시크 측은 AI 모델이 스스로 정답을 찾아가는 '그룹 상대 정책 최적화'(GRPO) 학습 방식과 특정 작업시 문제 해결에 필요한 부분만 AI를 활성화 하는 '전문가 혼합'(MoE) 기법 등 효율성을 극대화하는 방식을 택해 비용을 줄였다고 설명한다. 주요 사용 칩은 엔비디아의 H800이고, 추론 과정에서 중국 화웨이 칩도 사용했다고 밝혔다.딥시크가 밝힌 개발 비용에 대해서는 논란이 있다. 미국 반도체 연구 및 컨설팅 업체인 세미애널리시스는 최근 딥시크의 AI 모델 개발에 필요한 하드웨어 지출이 ""현재까지 투입된 비용만 5억달러를 훨씬 웃돌 것""이라고 했다. 딥시크 측이 밝힌 비용보다 90배 크다.딥시크 쪽의 주장이 사실이 아닐지라도 의미는 있다. 오픈 AI가 쌓아높은 공고한 '규모의 경제 법칙'을 깼다는 점, 그리고 폐쇄형이었던 챗GPT와 달리 오픈소스를 앞세운다는 점에서 한국을 비롯해 많은 국가에 기회가 될 것이라는 전망이 나온다.특히 국내에서는 네이버에 대한 기대가 크다. 네이버는 하이퍼클로바X라는 자체 AI 모델을 개발해 서비스를 선보이고 있다. 올해 주요 서비스 전반에 AI를 적용하겠다는 '온 서비스 AI'를 내세웠다. 또 사우디아라비아 데이터인공지능청(SDAIA)과 AI 분야 아랍어 기반 협력을 맺는 등 해외 진출도 더 빨라질 것으로 점쳐진다.카카오는 자체 LLM(거대언어모델)을 개발하기보다 다른 AI 모델을 차용해 개인 밀착형 에이전트 모델을 개발하는 모델 오케스트레이션 방식에 초점을 맞추겠다고 밝혀왔다. 게다가 오는 4일 오픈AI와 손잡고 새로운 AI 서비스 '카나나'를 선보인다는 소식이 기대감을 더했다.증시가 이들에 대한 기대감을 가장 빠르게 반영했다. 카카오와 네이버의 주가는 3일 전일대비 각각 9%, 0.23% 상승한 4만1800원, 21만7000원에 마감했다. 이날 코스피 지수가 2.52% 하락하는 가운데서도 올랐다. 전 거래일에는 각각 7%, 6%대 상승했다.증권가에서는 딥시크 쇼크와 관련해 네이버에 대한 매수 리포트가 다수 등장했다. 김지현 흥국증권 연구원은 ""네이버가 그동안 AI로 세계와 경쟁이 어렵다고 봤는데 딥시크의 오픈소스 전략으로 낙수효과를 볼 가능성이 크다""면서 ""앞으로 소프트웨어 업체들에 대한 기대감이 커질 것""이라고 예상했다. 최승호 상상인증권 연구원 역시 ""딥시크의 방법론을 제대로 따라할 수 있다면 그동안 인프라 비용 때문에 진행되지 못했던 국내외 AI 개발이 활발해질 것""이라고 전망했다.딥시크가 오픈소스로 공개했지만 구체적인 노하우까지 공개하지는 않았기 때문에 한국형 AI가 딥시크와 동일선상에 오르기까진 시간이 필요할 것으로 보인다.한 업계 관계자는 ""딥시크가 공개한 것은 엄밀히 말하면 소스코드나 데이터 등은 아니어서 그대로 따라할 수 있는 것이 아니다""라며 ""증류식 추출이라는 학습방식은 기존에도 암암리에 사용하던 것인데, 그 방식을 차용한다고 해서 당장 딥시크같은 성과를 내긴 쉽지 않다""고 지적했다. 다만 그는 ""AI를 경량화하는 방법, 자본이 상대적으로 부족한 기업들에 대해 힌트를 준 것에 대한 기여도가 있다는 점에서 의의가 있다""고 덧붙였다.",https://thumb.mt.co.kr/06/2025/02/2025020316083764501_1.jpg/dims/optimize/,2025-02-03
머니투데이,"""TC본더로 날았다""…한미반도체, 지난해 매출·영업이익 '사상 최대' - 머니투데이",http://news.mt.co.kr/mtview.php?no=2025020314312263221,"한미반도체는 지난해 연간 매출 5589억원, 영업이익 2554억원을 기록했다고 3일 밝혔다. 1980년 창사 이래 매출·영업이익 모두 최대치다.한미반도체는 지난해 AI(인공지능) 열풍으로 수요가 급증한 HBM(고대역폭메모리)의 제조 장비인 TC 본더 등 판매가 크게 늘며 사상 최대 실적을 기록했다. 지난 2005년 코스피 상장 당시 매출(790억원)과 비교하면 약 20년 만에 7배 이상 성장했다.한미반도체는 인천 서구 주안국가산업단지에서 총 6개 공장을 운영 중이며 올해 공장 1개를 증설할 계획이다.회사는 ""HBM 생산용 TC본더, 반도체 패키지용 MSVP, 스마트기기·위성통신에 적용되는 EMI 쉴드 장비와 그라인더, 장비 소모품 생산 라인에서 매출 기준 총 2조원까지 대량 생산이 가능한 시스템을 구축했다""고 밝혔다. 이어 ""설계, 부품 가공, 소프트웨어, 조립, 검사 공정까지 외주 가공 없이 모두 직접 진행하는 수직 계열화 시스템을 갖췄다""고 했다.한미반도체는 엔비디아, 브로드컴에 적용되는 HBM3E 12단과 HBM4, HBM5 출시에도 회사의 TC 본더, FLTC 본더, 하이브리드 본더가 역할을 할 것으로 내다봤다.회사는 ""AI 시장 확장에 따른 '칩 온 웨이퍼 온 서브스트레이트(CoWoS)' 시장 성장과 고객사 요구에 따라 2.5D용 빅다이본더를 고객사에 공급할 계획""이라며 ""스마트 기기와 위성 통신 기기에 적용 가능한 EMI 쉴드 장비, 향후 유리기판 시장 개화에 대응하기 위해 유리기판 절단용 MSVP를 개발해 고객사 납품을 준비하고 있다""고 밝혔다.",https://thumb.mt.co.kr/06/2025/02/2025020314312263221_1.jpg/dims/optimize/,2025-02-03
머니투데이,머니투데이 오프라인 헤드라인-3일자 - 머니투데이,http://news.mt.co.kr/mtview.php?no=2025020221443813561,"결국, 관세폭탄 투하…전세계가 사정권자체 개발한 척…사진 도용 양자컴, 아직 빈껍데기 수준'불황 덕' 호황…10대 로펌 매출 증가백용호 전 청와대 정책실장, 머니투데이 상임고문에 선임""민간·정부 잇는 연결고리…'월드 베스트' 될 기업 발굴 지원눈에는 눈…加 ""美에 25% 보복관세""·멕시코 ""플랜B 실행""中 ""美 잘못된 행동…WTO 제소""韓 생산기지 '1차'로 맞았다…年수출 7000억弗 '목표' 흔들가전, 기지 이전·3국 생산 모색…배터리, 공장 건설 속도조절 검토K가전 '콕' 찍어 압박투자금 몰린다는데…100점 만점에 '2.3점' 韓 기술력 처참게임체인저 내세웠지만, 계엄·탄핵에 발목실적 성공여부·전문가 검증, 투자 전 반드시 체크고객이라는 파도를 이해하고 있습니까돌아와요 '창드래곤'개인 맞춤형 의료혁명이 온다규제와의 전쟁연구자만 41만명, 위협적인 中 'AI 굴기'젠슨 황 만난 트럼프…대중규제 더 견고해진다이재용 경영족쇄 풀리나…1심 무죄 유지땐 '뉴삼성' 날개워싱턴 가는 최태원, 경제위기 해법 찾는다영국행 제네시스, 친환경 전환 '속도'미국 홀린 K뷰티, 대형마트서 팬심 넓힌다올해만 3조 기대…폐지땐 K배터리 '방전'이찬우號 농협금융 내부통제·DX 속도낸다선택 아닌 필수템으로…여행자보험 가입 48%↑보너스 받아 빚부터 갚았다…가계대출 열달만에 '뒷걸음'판 커지는 CDMO, 세 키우는 기업·국가'1400억 몸값' 기대…오가노이드사이언스, 내달 IPO 출격코로나 다음은 조류독감 온다?…질병청, 인수공통 감염병 대비'대륙의 AI' 파동에 K팹리스 긴장…""기회로 삼아야""프렌들리AI, '딥시크 부상' 내다본 허깅페이스와 합심영어 질문엔 '공산당' 강조…習묻자 ""탁월한 지도자""작업별 필요한 LLM만 활성화 '메모리 사용량 90%↓'안내방송으론 역부족…보조배터리 기내 반입규정 강화서울 집값 떨어는데…'64억 신고가' 강남만 오른다멀어진 금리인하…더 짙어진 관망세무명 견딘 뚝심…그 속엔 진심인기폭발 '중증외상센터', 시즌2 요청도 폭발유재석·전현무와 어깨 나란히…""틈날 때마다 조언 받고 공부했죠""세계 무대 선 '韓 AI 교과서' 스포트라이트임신한 공무원, 주 1회 재택근무'네트워크 로펌' 매출 질주…중위권 추월오랜만에 만나 얼굴 붉힐라 ""탄핵의 ㅌ자도 안꺼냈어요""쑥쑥 자라는 ETF 효자노릇…10대 자산운용사 곳간 두둑金빛 질주, 금ETF도 '반짝반짝'中딥시크 이어 美관세…코스피 감당할까",,2025-02-03
이데일리,"코스피, 관세 전쟁 우려 완화 속 상승…삼성전자, 3%대↑",http://www.edaily.co.kr/news/newspath.asp?newsid=03158646642067240,"[이데일리 원다연 기자] 코스피 지수가 4일 장중 기관의 매수 속 상승 흐름을 이어가고 있다.엠피닥터에 따르면 이날 오후 2시 2분 현재 코스피 지수는 전 거래일 대비 1.28% 오른 2485.32에 거래되고 있다.코스피 시장에서는 외국인과 기관이 각각 227억원, 2882억원 규모를 순매도하고 기관이 2365억원 규모를 순매수하고 있다.이재원 신한투자증권 연구원은 “전일 최악의 관세 전쟁 상황을 가정하며 낙폭을 키웠던 코스피는 우려 완화에 반등하고 있다”고 밝혔다.업종별로 보면 기계장비(3.87%), 일반서비스(2.27%), 오락문화(2.16%) 등의 큰 폭으로 오르고 있다. 반면 전기가스(-0.64%), 음식료담배(-0.17%) 등은 하락 중이다.시가총액 상위 종목의 흐름은 엇갈리고 있다. 삼성전자(005930)는 이재용 회장의 사법리스크 해소에 더해 오픈AI와 협력 소식에 3.33% 상승 중이며, 전일 낙폭이 컸던 SK하이닉스(000660)도 0.63% 반등하고 있다. 반면 LG에너지솔루션(373220)(-0.30%), 삼성바이오로직스(207940)(-1.83%)는 하락하고 있다. 이밖에 전날 관세 전쟁 우려에 하락했던 현대차(005380)(0.99%), 기아(000270)(0.83%)가 반등하고 있고, 셀트리온(068270)(1.14%), KB금융(105560)(2.48%), NAVER(035420)(0.46%) 등도 오르고 있다.",https://image.edaily.co.kr/images/photo/files/NP/S/2025/02/PS25020400805.jpg,2025-02-04
이데일리,"美, 멕시코·캐나다 관세 유예에 코스피 반등",http://www.edaily.co.kr/news/newspath.asp?newsid=03804806642067240,코스피가 오늘(4일) 미국 트럼프 행정부의 관세 부과 유예 소식에 힘입어 장중 2500선을 회복했습니다.코스피 지수는 전장 대비 27.49포인트(1.12%) 오른 2481.44로 출발해 오름폭을 키우다 2481.69로 장을 마감했습니다.원·달러환율은 전장보다 8.2원 내린 1459.0원으로 거래를 시작해 1460원대를 등락했습니다.도널드 트럼프 미국 대통령이 오는 4일부터 멕시코와 캐나다에 부과하기로 한 25% 관세를 한 달간 유예하기로 결정하면서 위험자산 회피 심리가 완화된 영향으로 풀이됩니다.,https://image.edaily.co.kr/images/photo/files/NP/S/2025/02/PS25020401067.jpg,2025-02-04
이데일리,미국 멕시코·캐나다 관세 유예에 2480선 회복[코스피 마감],http://www.edaily.co.kr/news/newspath.asp?newsid=03614566642067240,"[이데일리 김경은 기자] 미국의 대(對)멕시코·캐나다 관세 한 달 유예 결정에 투자심리가 빠르게 회복됐다. 4일 코스피는 외국인과 기관의 동반 매수세에 힘입어 상승 마감했다.엠피닥터에 따르면 이날 코스피는 전 거래일 대비 27.74포인트(1.13%) 오른 2481.69에 장을 마쳤다.투자자별 매매동향을 보면 외국인과 기관이 각각 797억원, 1262억원 순매수를 기록했고, 개인은 2960억원 순매도했다. 프로그램 매매는 차익거래에서 140억원 순매도, 비차익거래에서 1327억원 순매수를 보였다.시가총액 상위종목 가운데 삼성전자(005930)는 이재용 회장이 전날 부당합병·회계부정 의혹 사건에서 무죄를 받은 영향까지 더해지며 1700원(3.33%) 오른 5만2700원에 거래를 마쳤고, 딥시크 충격 이후 약세를 보였던 SK하이닉스(000660)는 200원(0.10%) 오른 19만1100원에 마감했다.이밖에 기아(000270)(0.62%) 셀트리온(068270)(0.80%) KB금융(105560)(2.82%) 삼성전자우(005935)(3.59%) NAVER(035420)(0.69%) 등은 상승했지만, LG에너지솔루션(373220)(-1.04%) 삼성바이오로직스(207940)(-2.10%) 현대차(005380)(-0.50%) 등은 하락해 등락이 엇갈렸다.업종별로는 기계 4.34%, 생명과학 3.84%, 기타자본재 3.80%, 조선 3.66% 등 대부분 오름세로 마감했다. 반면 상사(-2.38%), 철강(-2.33%) 등은 하락했다.상승 698종목, 하락 209종목, 보합 40종목을 기록했다. 거래량은 4억7312만주, 거래대금은 10조8333억원을 기록했다.코스닥 지수는 전장보다 16.12포인트(2.29%) 오른 719.92에 마감했다.",https://image.edaily.co.kr/images/photo/files/NP/S/2025/02/PS25020400991.jpg,2025-02-04
이데일리,"코스피, 개인·기관 매수에 1%대 상승 출발…2480선 회복",http://www.edaily.co.kr/news/newspath.asp?newsid=02151686642067240,"[이데일리 김경은 기자] 도널드 트럼프발(發) 관세 전쟁이 한 템포 쉬어가면서 코스피도 전날 낙폭을 만회해 1%대 반등세가 나오고 있다.엠피닥터에 따르면 4일 오전 9시 3분 현재 코스피지수는 전장보다 26.69포인트(1.09%) 오른 2480.64를 기록하고 있다.투자자별 매매동향을 보면 개인과 기관이 각각 123억원, 294억원을 순매수한 반면, 외국인은 431억원을 순매도했다.도널드 트럼프 미국 대통령은 이날부터 멕시코와 캐나다에 부과하기로 한 25% 관세 계획을 한 달간 유예하기로 했다. 중국과도 24시간내 관세 부과와 관련한 대화를 나눌 것이라고 밝혔다.이날 뉴욕 증시는 트럼프의 관세 정책 추이에 따라 롤러코스터를 타면서 하락 마감했다. 뉴욕증권거래소(NYSE)에서 다우존스30산업평균지수는 전장보다 122.75포인트(0.28%) 내린 4만4421.91에 거래를 마감했다. 스탠더드앤드푸어스(S&P)500지수는 전장보다 45.96포인트(0.76%) 밀린 5994.57, 나스닥종합지수는 235.49포인트(1.20%) 떨어진 1만9391.96에 장을 마쳤다.한지영 키움증권 연구원은 “전일 낙폭 과대 인식 속 멕시코와 캐나다 관세 부과 연기 소식 등에 힘입어 반도체, 자동차 등 관세 피해 수출주를 중심으로 반등에 나설 전망”이라고 예상했다.다만 관세 유예 소식 변동성이 남은 만큼 상단은 제한적이란 분석도 있다. 김지현 다올투자증권 연구원은 “간밤에 전해진 멕시코, 캐나다 관세 유예 소식에 저가매수세가 유입되겠으나, 기술주 투자심리 약화, 중국 관세 협상 관련 뉴스플로우에 상단은 제한적일 것”으로 내다봤다.업종별로는 게임소프트웨어 3.76%, 전기장비 2.52%, 소프트웨어 2.45% 등이 상승세가 두드러진 가운데 대부분 업종에서 상승 거래되고 있다.시가총액 상위 종목도 대부분 올랐다. 삼성전자(005930)는 1.37% 오른 5만1700원에 거래되고 있으며, SK하이닉스(000660)는 0.89% 상승한 19만2600원을 기록 중이다. 이어서 LG에너지솔루션(373220)(1.49%), 현대차(005380)(1.73%), 기아(000270)(2.60%), 셀트리온(068270)(0.28%), KB금융(105560)(1.91%), NAVER(035420)(2.76%), 삼성전자우(005935)(1.08%) 등도 상승세다.",https://image.edaily.co.kr/images/photo/files/NP/S/2025/02/PS25020400450.jpg,2025-02-04
이데일리,작년 주식 전자등록 발행액 24.6조…전년비 11% 감소,http://www.edaily.co.kr/news/newspath.asp?newsid=02450166642067240,"[이데일리 김응태 기자] 지난해 한국예탁결제원을 통한 주식 전자등록 발행 규모가 전년보다 감소한 것으로 집계됐다. 유가증권(코스피)에서 발행 금액이 큰 폭 줄어든 반면, 코스닥에선 발행금액이 전년보다 늘었다. 코스닥 시장을 중심으로 유상증자와 액면변경 관련한 전자등록이 늘어난 것으로 분석된다.4일 한국예탁결제원에 따르면 지난해 주식 전자등록 발행금액은 24조6400억원을 기록해 전년 대비 10.9% 줄었다.발행금액 중 유가증권 상장법인의 발행금액은 11조1491억원으로 전년 대비 18.0% 감소했다. 반면 코스닥 상장법인 발행금액은 9조7575억원으로 3% 증가했다.지난해 주식 전자등록 발행수량은 184억5700만주로 전년(177억8800만주)보다 3.2% 증가했다. 전체 발행수량 중 코스닥 상장주식은 101억8000만주로 전년보다 44.6% 늘어 발행주식 증가를 견인했다. 이와 달리 유가증권 상장주식은 36억8000만주로 전년보다 20.7% 감소했다. 이외에 비상장법인 상장주식 36억8000만주, 코넥스 상장주식 1억2000만주 등을 기록했다.전체 발행수량 중 유상증자에 따른 발행이 65억9000만주로 가장 큰 비중(35.7%)을 차지했다. 뒤이어 액면변경 26억7000만주(14.5%), 신규참여가 14억8000만주(8.0%) 등의 비중을 나타냈다.지난해 주식 전자등록 발행회사는 1274개사로 전년보다 5.7% 감소했다.지난해 전자증권제도를 통해 새로 발행되거나 전자증권으로 전환된 신규 발행회사는 244개사로 전년보다 10.6% 감소했다. 신규 발행수량은 26억5000만주로 전년 대비 11.9% 감소했다.",https://image.edaily.co.kr/images/photo/files/NP/S/2025/02/PS25020400506.jpg,2025-02-04
